date,source,title
2025-04-21,abc-news,WATCH: Crowd gathers outside Pope Francis’ childhood church in Argentina
2025-04-21,unknown,The futility of fact checkers
2025-04-21,the-jerusalem-post,Holocaust Remembrance Day and Armenian genocide: A moment of shared remembrance
2025-04-21,unknown,EVs in the spotlight as China claims a leading global role at Shanghai's auto show
2025-04-21,unknown,Trump's Ukraine peace offer could endorse Russia's gains
2025-04-21,financial-post,EVs in the spotlight as China claims a leading global role at Shanghai’s auto show
2025-04-21,unknown,Auto Shanghai Showcases New EV Era Despite Tariff Speedbumps
2025-04-21,unknown,Auto Shanghai showcases new EV era despite tariff speedbumps
2025-04-21,unknown,‘Do Not Capitulate’: Ex-Biden ‘Disinformation’ Czar Goes To Europe To Advocate Against US ‘Autocracy’
2025-04-21,rt,Witkoff expects to meet Putin – White House
2025-04-21,unknown,Pentagon employees were ousted after turf war in Hegseth’s office: source
2025-04-21,unknown,"Global leaders condemn Pahalgam terror attack; Trump, Putin, Meloni express solidarity with India"
2025-04-21,unknown,Trump says he has 'no intention' of firing Federal Reserve chair
2025-04-21,unknown,Forever or Nothing?
2025-04-21,financial-post,"Saudi Arabia, India Agree to Set Up Two Oil Refineries"
2025-04-21,unknown,"Trump's ""final offer"" for peace requires Ukraine to accept Russian occupation"
2025-04-21,unknown,S&Ds: We need a bigger and better EU pluriannual budget post-2027
2025-04-21,financial-post,EU Discusses Targeting of Spot Market for Russian Gas Phaseout
2025-04-21,unknown,"Investor Alert: Super Micro Computer, Marqeta, SentinelOne, and ON Semiconductor Corporation: Johnson Fistel, LLP Investigates Claims on Behalf of Investors"
2025-04-21,unknown,News Wrap: Hegseth threatens criminal prosecution over leaks
2025-04-21,unknown,Foreign policy experts offer views on Trump administration’s student activist crackdown
2025-04-21,unknown,Yiddish is making a comeback
2025-04-21,nbc-news,Judge questions deportation case of Harvard scientist accused of smuggling frog embryos
2025-04-21,unknown,They shuttered the truth-spotting crew
2025-04-21,newsweek,Costa Rica Grants 3-Month Permits to Some US-Deported Migrants
2025-04-21,unknown,Pope Francis’s Aesthetics of Humility
2025-04-21,rt,Rubio and Witkoff to skip London Ukraine talks
2025-04-21,unknown,10 WrestleMania Entrances That Were Better Than the Actual Match
2025-04-21,unknown,Commentary: The weakening Arctic consensus is worrying
2025-04-21,unknown,Countries Face Pressure to Pick Sides in U.S.-China Trade War
2025-04-21,unknown,"Vlad 'secret son, 10, with Olympic gymnast pictured for first time after leak'..."
2025-04-21,unknown,Trump Team Unveils Massive State Department Overhaul
2025-04-21,unknown,"Japan to cut energy, electricity costs for households"
2025-04-21,unknown,Utah Hockey Club looks to bring two of its top prospects to North America
2025-04-21,unknown,Ukraine presses for ceasefire as Russia reported to offer concession
2025-04-21,unknown,Daily Press Briefing by the Office of the Spokesperson for the Secretary-General
2025-04-21,unknown,People from around the world descend on Vatican City to pay respects to Pope Francis
2025-04-21,unknown,"WOW Festival returns to UC San Diego with bold, immersive performances"
2025-04-21,the-next-web,"‘Electrotech’ can cut Europe’s reliance on fossil fuel imports, report finds"
2025-04-21,nbc-news,"At least 26 tourists killed by gun men at a resort in Kashmir, Indian police say"
2025-04-21,unknown,Zelenskyy says Ukraine will only hold direct talks with Russia after ceasefire is in place
2025-04-21,rt,Only trust firsthand sources on US-Russia talks – Kremlin
2025-04-21,unknown,"Trump to visit Saudi Arabia, Qatar, UAE in May"
2025-04-21,msnbc,Groundbreaking cancer research at risk as Trump threatens to deport key scientist
2025-04-21,financial-post,Sportradar Announces Preliminary First Quarter 2025 Financial Results
2025-04-21,financial-post,Sportradar Announces Launch of Public Offering of Class A Ordinary Shares by Selling Shareholders and Concurrent Share Repurchase
2025-04-21,unknown,Yet another debate: Dutton improves performance but polls show continued decline for LNP
2025-04-21,unknown,Sportradar Announces Preliminary First Quarter 2025 Financial Results
2025-04-21,unknown,Sportradar Announces Launch of Public Offering of Class A Ordinary Shares by Selling Shareholders and Concurrent Share Repurchase
2025-04-21,unknown,First Busey Corporation Announces 2025 First Quarter Results
2025-04-21,unknown,Should Trump Fire Pete Hegseth? Absolutely Not!
2025-04-21,unknown,Watching Andrew Garfield explore his family history was like seeing a teddy bear marching towards the machine guns
2025-04-21,unknown,Baker Hughes Company Announces First-Quarter 2025 Results
2025-04-21,unknown,‘60 Minutes’ Top Producer Resigns: Says He Lost Journalistic Independence Amid Trump Fight
2025-04-21,unknown,Prime Minister Christopher Luxon to attend Pope Francis’ funeral
2025-04-21,unknown,Celebrate Earth Day by Going Nuclear
2025-04-21,unknown,Ukraine ready to negotiate with Russia — if it agrees to ceasefire first - politico.eu
2025-04-21,unknown,Donald Trump Is Hell-Bent on Destroying the Economy
2025-04-21,rt,"Russian greatness, American grief, endless love: Honoring the legacy of Russia’s most famous sculptor (PHOTOS)"
2025-04-21,unknown,Ukraine’s Zelensky Pushes Back on U.S. Peace Plan
2025-04-21,unknown,America Isn’t Israel’s Bodyguard
2025-04-21,unknown,Going for the gold haven
2025-04-21,unknown,FBI Analyst Who Resigned Over Kash Patel Announces Congressional Run
2025-04-21,unknown,"With Yemen Attack, US Continues Long History of Deliberately Bombing Hospitals"
2025-04-21,unknown,Colin Blackwell scores first NHL career overtime winner
2025-04-21,unknown,Who Will Attend Pope Francis’s Funeral?
2025-04-21,unknown,Millions of SK Telecom customers are potentially at risk following USIM data compromise
2025-04-21,unknown,Marco Rubio announces overhaul of U.S. State Department
2025-04-21,unknown,Here's What Happened Today: Tuesday
2025-04-21,unknown,"Pam Bondi didn't say, 'It's probably a crime to accuse the president of committing a crime after he breaks the law'"
2025-04-21,unknown,Why mom joined Supreme Court lawsuit over LGBTQ+ books in elementary school: ‘Emphasis on children’s romantic emotions’
2025-04-21,unknown,Vladimir Putin offers to halt Ukraine invasion along current front line (Financial Times)
2025-04-21,unknown,"STERIS to Host a Conference Call for Fiscal 2025 Fourth Quarter and Full Year Financial Results on May 15, 2025"
2025-04-21,unknown,Trump-era elections in the Anglosphere
2025-04-21,unknown,Weatherford Announces First Quarter 2025 Results
2025-04-21,unknown,"QCR Holdings, Inc. Announces Net Income of $25.8 Million for the First Quarter of 2025"
2025-04-21,unknown,SHOCKING: 3rd Trump Assassin’s Ukrainian Connection EXPOSED? | Elijah Schaffer’s Top 5 (VIDEO)
2025-04-21,rt,Putin expresses condolences over deadly terror attack in India
2025-04-21,unknown,"Kashmir Massacre: Trump, Putin, Iran, Israel Condemn Jihadist Attack on Hindu Tourists"
2025-04-21,newsweek,"Kashmir Massacre: Trump, Putin, Iran, Israel Condemn Jihadist Attack on Hindu Tourists"
2025-04-21,unknown,"Terrorists kill 26 people, mostly tourists, in Pahalgam’s ‘mini Switzerland’"
2025-04-21,rt,"The EU’s illusion of relevance: No vision, no power, no future"
2025-04-21,unknown,Intuitive Announces First Quarter Earnings
2025-04-21,unknown,Who’s Leaking at the Pentagon? Hegseth Keeps Plugging.
2025-04-21,unknown,"WTI Rebounds 2% on Supply, Geopolitical Shifts"
2025-04-21,financial-post,The top producer at ’60 Minutes’ has quit. He says he can no longer run the show as he always has
2025-04-21,rt,Germany tapping industry to bolster NATO response to ‘Russian attack’ – Handelsblatt
2025-04-21,abc-news-au,Zelenskyy says Ukraine to negotiate with Russia if ceasefire put in place
2025-04-21,unknown,Marco Rubio’s Soulless Crusade
2025-04-22,the-jerusalem-post,'You are our victory': Holocaust survivor tells her story to female Israeli soldiers
2025-04-22,unknown,"Trump’s Latest Executive Orders Target Accreditation, Foreign Gifts"
2025-04-22,unknown,Ukraine Authorities Report Missile Attack On Kyiv
2025-04-22,unknown,Ukraine defiant on U.S. pressure as Trump accuses Zelensky of boasting
2025-04-22,rt,Russia easier to deal with than Ukraine – Trump
2025-04-22,unknown,Call for cheaper holidays to attract Chinese
2025-04-22,unknown,Sirens blare across Ukraine amid Russian air raid
2025-04-22,unknown,Trump team signals possibility of lower tariffs on PRC goods; Xi on climate; China working the EU; China-Russia financial sanctions evasion
2025-04-22,unknown,Why South Africa and Ukraine are wooing each other - and what will Trump think?
2025-04-22,bbc-news,Ukraine's Volodymyr Zelensky meets South Africa's Cyril Ramaphosa to counter Russia
2025-04-22,unknown,"April 23, 2025 – PBS News Hour full episode"
2025-04-22,unknown,Why Ukraine is in an impossible spot with the White House peace deal
2025-04-22,unknown,Vance Outlines U.S. Plan for Ukraine That Sharply Favors Russia
2025-04-22,unknown,Fox’s Brit Hume Baffled by Trump’s Putin Comment: ‘I’m Not Exactly Sure What the President’s Talking About’
2025-04-22,unknown,JUST IN: Trump Says “I Think We Have a Deal with Russia” on Peace with Ukraine – “I Think we Have a Deal with Both. I Hope They Do it”
2025-04-22,unknown,Donald Trump attacks Ukraine for not recognising Russian occupation of Crimea (Financial Times)
2025-04-22,unknown,Trump and Zelenskyy clash again and U.S. warns it could abandon Ukraine talks
2025-04-22,unknown,'Not serious': Lawmaker blasts Hegseth for installing Pentagon makeup studio for TV spots
2025-04-22,unknown,Future of Biden-era US aid to Ukraine unclear as Trump threatens to walk away from peace process
2025-04-22,the-jerusalem-post,Five reasons why is it right to sanction Russia but not sanction Israel
2025-04-22,unknown,"Air defence units counter drone, missile attack in Kyiv, officials say"
2025-04-22,unknown,What the U.S. is offering and demanding in latest Ukraine ceasefire proposal
2025-04-22,unknown,"Europe needs to ‘step up’ defense spending, National Security Adviser Mike Waltz says, as Trump threatens to pull out of Ukraine peace talks"
2025-04-22,unknown,Russia to launch national crypto exchange limited to high net-worth investors
2025-04-22,unknown,Notice: General Trade Licence for sanctioned Russian synthetic diamonds processed in third countries
2025-04-22,unknown,A reinforced EDIP as backbone for European autonomy and common defence
2025-04-22,unknown,"Mining Companies Must Obtain Free, Prior, Informed Consent, Partner with Indigenous Peoples to Ensure Responsible, Ethical Land Use, Speakers Tell Permanent Forum"
2025-04-22,cbc-news,Former U.S. intelligence analyst sentenced to 7 years for selling 'sensitive' information
2025-04-22,unknown,Explosions sound in Ukraine's Kiev
2025-04-22,unknown,Trump And Zelensky Clash Again As US Says Crimea Now Russian Territory
2025-04-22,unknown,Inside the Fight Over Trump’s Foreign Policy
2025-04-22,unknown,"Donald Trump Gives Update on Potential Ukraine, Russia War Deal"
2025-04-22,unknown,"""I Think We Have A Deal With Russia"" To End Ukraine War, Says Trump"
2025-04-22,rt,Ukrainian youths throw Nazi salute at Holocaust memorial (PHOTOS)
2025-04-22,newsweek,"Donald Trump Gives Update on Potential Ukraine, Russia War Deal"
2025-04-22,unknown,"JD Vance Issues Ultimatum to Ukraine, Russia Over Proposal to End War"
2025-04-22,unknown,Convicted fraudster cardinal stripped of papal conclave voting rights insists on participating as Pope Francis lies in state
2025-04-22,newsweek,"JD Vance Issues Ultimatum to Ukraine, Russia Over Proposal to End War"
2025-04-22,nbc-news,Senate Democratic retirements clear the way for a new generation: From the Politics Desk
2025-04-22,unknown,Trump: 'I think Russia is ready' for ceasefire
2025-04-22,unknown,"Zelensky Disrupts Today’s Talks, US Secretary Rubio Cancels Trip to London and Negotiations Get Downgraded to ‘Technical’ Level – Will Trump Walk Away From Peace Process?"
2025-04-22,unknown,"Trump envoy Witkoff is expected to meet Putin on Friday, Axios reports"
2025-04-22,unknown,Trump: 'I think we have a deal with Russia'
2025-04-22,the-jerusalem-post,Ukraine opens criminal case against three men who performed Nazi salutes at Holocaust memorial
2025-04-22,fox-news,Fox News Poll: The first 100 days of President Trump’s second term
2025-04-22,unknown,Ryan Eggold Joins ‘Seven Sisters’ FX Pilot
2025-04-22,unknown,Goodbye Social Security payments for retirees and disability beneficiaries in April
2025-04-22,unknown,When is Pope Francis' funeral?
2025-04-22,unknown,This state has the most Gen Z and millennial kids still living at home — here’s why their parents are stuck with them
2025-04-22,unknown,Trump Slams Zelenskyy for 'Inflammatory' Crimea Comment
2025-04-22,unknown,Is Trump About to Abandon Ukraine?
2025-04-22,the-jerusalem-post,Vienna remembers the Holocaust with music
2025-04-22,unknown,Czech leaders condemn Russian threats against NHL great Dominik Hasek
2025-04-22,unknown,Officials met in London to discuss peace talks on Russia's war on Ukraine
2025-04-22,unknown,"Am I Surprised That JD Vance Is Pushing a Russia-Friendly Peace Plan on Ukraine? No, I Am Not."
2025-04-22,unknown,Moscow may gain key role in Iran nuclear deal as US talks progress
2025-04-22,unknown,Second Fukushima debris removal trial completed
2025-04-22,unknown,Russia adds 21 British lawmakers to its 'banned' list
2025-04-22,unknown,"Trump, Zelenskyy clash again and U.S. warns it could abandon Ukraine talks"
2025-04-22,unknown,Catholic faithful pay their final respects to Pope Francis as public viewing begins
2025-04-22,abc-news-au,What’s being done to protect Australia’s northern coastline?
2025-04-22,unknown,FAIR: Pope Francis Obits Omit Focus on Palestine
2025-04-22,unknown,"Trump’s fascism, and what to do about it: a reading list"
2025-04-22,unknown,The Trump Administration Wants to Make Us Too Afraid to Look Out for One Another. Don’t Let Them.
2025-04-22,unknown,Kashmir Reels From Deadliest Attack on Civilians in Decades
2025-04-22,unknown,"If bitcoin mining isn’t that profitable, why do people do it"
2025-04-22,the-jerusalem-post,Uncovering the truth: French Catholic priest discusses mission to document the Holocaust
2025-04-22,rt,White House accuses Zelensky of megaphone diplomacy
2025-04-22,breitbart-news,"Trump Target, Registered Democrat Judge Beryl Howell Has History of Anti-Trump Actions"
2025-04-22,unknown,Trump slams Zelensky for refusing to recognize Russian control of Crimea - CNN
2025-04-22,unknown,Trump Is Acting as a Proxy for Putin (Tom Nichols/The Atlantic)
2025-04-22,unknown,Ukraine's Zelensky Pushes Back on U.S. Peace Plan (Wall Street Journal)
2025-04-22,unknown,Zelenskiy Says Ukraine Won't Cede Territory to Russia for Deal
2025-04-22,rt,Russia isn’t seeking Zelensky’s removal – Kremlin
2025-04-22,unknown,Marco Rubio’s Spokeswoman Has Tantrum on Air Over Ukraine Talks
2025-04-22,unknown,London talks end without Ukraine war peace deal as Zelensky says ‘emotions have run high’ over US bid to recognize Crimea as Russian
2025-04-22,unknown,Peter Dutton backflips on electric vehicle tax breaks (apparently he ‘misheard’)
2025-04-22,fox-news,Fox News Politics Newsletter: Senate Dems' No. 2 to Bid Adieu
2025-04-22,unknown,Russia launching crypto exchange for qualified investors: report
2025-04-22,financial-post,China says it wants to partner with Canada to push back against American ’bullying’
2025-04-22,unknown,One of the Most Complex Cases of the Supreme Court Term Is Also One of the Most Straightforward
2025-04-22,unknown,"Music world’s anti-Israel blinders, restore parents’ opt-out rights and other commentary"
2025-04-22,rt,"‘EU wants war, not talks’ – Kremlin"
2025-04-22,unknown,"Trump wants to emulate Putin and govern US in 'a similar fashion', ex-national security adviser says"
2025-04-22,unknown,China plans nuke power plant on moon...
2025-04-22,unknown,Former USA boss Arena suggests Pochettino doesn't 'understand' role
2025-04-22,unknown,Sudan's hell of devastation and despair
2025-04-22,unknown,Trump says Zelenskyy is prolonging war in Ukraine by resisting calls to cede Crimea
2025-04-22,unknown,"[Latest] Global Plastic Pallet Market Size/Share Worth USD 13,591 Million by 2034 at a 89% CAGR: Business Research Industry (Analysis, Outlook, Leaders, Report, Trends, Forecast, Segmentation, Growth, Growth Rate, Value)"
2025-04-22,unknown,Trump Is Acting as a Proxy for Putin
2025-04-22,unknown,"U.S. Blocking Countries From Hitching Ride With Rival Moon Base Project, China Claims"
2025-04-22,unknown,Bosnia state police fail in attempted arrest of Serb leader Dodik
2025-04-22,financial-post,Plexus Announces Fiscal Second Quarter Financial Results
2025-04-22,unknown,Putin’s alleged son seen in leak | Reporter Replay
2025-04-22,unknown,Plexus Announces Fiscal Second Quarter Financial Results
2025-04-22,unknown,Prince Harry and Meghan Markle spotted in NYC with 4-car motorcade for Time100 Summit
2025-04-22,unknown,The Offer
2025-04-22,unknown,Watch Spider-Man KO Superman In Russian MMA Fight
2025-04-22,unknown,Migrant communities in NH on edge over temporary protected status
2025-04-22,unknown,"U.S. Issues “Truce” To Ukraine And Russia, But It’s NOT An Ultimatum?"
2025-04-22,unknown,India closes Pakistan border and expels diplomats over Kashmir 'terror attack'
2025-04-22,unknown,Armenia Walks Diplomatic Tightrope Between Russia and the West
2025-04-22,unknown,"Trump Approval Rating Tracker: Worst Economic Reviews In Years, Latest Poll Finds"
2025-04-22,unknown,Lyrics to Slaughter to Prevail's 'Russian Grizzly in America'
2025-04-22,unknown,Daily Press Briefing by the Office of the Spokesperson for the Secretary-General
2025-04-22,unknown,Plans confirmed to build a nuclear power plant on the moon
2025-04-22,unknown,"80-Year-Old Woman Falls from Sixth Floor Apartment, Survives Unscathed"
2025-04-22,business-insider,The Marines are deploying these new ship and drone killers to a strategic US ally in the Pacific
2025-04-22,rt,Smoke in Rome: What’s really cooking between Trump and Tehran?
2025-04-22,unknown,Retired County Board member leads daily ‘rush hour resistance’ at Fairlington’s I-395 overpass
2025-04-22,unknown,Gold prices plunge in biggest one-day drop in years. Is the record rally over?
2025-04-22,unknown,Hunter Biden: Burisma's Five Million Dollar Man
2025-04-22,unknown,Barbra Kruger to Unveil New Installation on Ukrainian Passenger Train
2025-04-22,unknown,Zelensky: Hope US acts in line with its decisions on Crimea
2025-04-22,unknown,Witkoff set to meet with Putin in Russia on Friday
2025-04-22,unknown,Trump Absolutely Loses It on Zelensky: ‘He Can Have Peace’ or Lose ‘the Whole Country’
2025-04-22,unknown,"Used EV prices fell 40%, and buyers are searching like never before"
2025-04-22,unknown,White House Says Trump’s ‘Patience Is Running Very Thin’ With Zelensky Amid Messy Peace Negotiations
2025-04-22,unknown,Zelensky calls for 'unconditional ceasefire' after Russian attack kills nine
2025-04-22,unknown,Zelenskyy - “Emotions have run high today” (tweets out screenshot of Pompeo’s 2018 statement on Crimea)
2025-04-22,unknown,Trump Says Zelensky Is Prolonging the ‘Killing Field’
2025-04-22,unknown,Vance Says Concessions Needed for Ukraine Peace Deal
2025-04-22,time,"Who Is Set to Attend Pope Francis’ Funeral? From Trump to Prince William, Here Are the Key Figures So Far"
2025-04-22,the-jerusalem-post,Trump envoy says there were positive talks in London with Ukraine official
2025-04-22,the-irish-times,The Irish Times view on the crisis in Sudan and Chad: a distracted world looks away
2025-04-22,unknown,Trump criticizes Zelenskyy amid stalled Ukraine-Russia peace talks
2025-04-22,unknown,Trump gives Zelensky dire warning on Russia-Ukraine war: Accept peace or risk ‘losing the whole country’
2025-04-22,rt,Reducing labor migrant numbers not in Russia’s interests – Lavrov
2025-04-22,unknown,Trump tells Zelenskyy to 'get it done' as peace talks on Ukraine war downgraded
2025-04-22,unknown,"Government Digital Experience, Amazon, Google Photos, More: Wednesday Afternoon ResearchBuzz, April 23, 2025"
2025-04-22,unknown,"Days after their singer adopted two bear cubs, Slaughter To Prevail announce new album Grizzly – stream lead single Russian Grizzly In America"
2025-04-22,unknown,There’s a Surprising New Tool to Challenge State Abortion Bans
2025-04-22,unknown,Here's What Happened Today: Wednesday
2025-04-22,unknown,Veteran Chinese astronaut to lead fresh crew to space station
2025-04-22,unknown,Trump Warns Zelenskyy: Accept Peace or Lose the Country
2025-04-22,abc-news-au,Peter Dutton is treading carefully when it comes to China
2025-04-22,al-jazeera-english,"‘It’s about time NATO be shut down’, says Vijay Prashad"
2025-04-22,unknown,Thousands honor Pope Francis in St. Peter’s Basilica | Honolulu Star-Advertiser
2025-04-22,unknown,A 'Drone Wall' Is Coming to NATO's Eastern Border
2025-04-22,unknown,"Ukraine peace talks: E3 statement, 23 April 2025"
2025-04-22,unknown,"Ukraine's Zelenskiy moving in wrong direction on peace talks, White House says"
2025-04-22,newsweek,A 'Drone Wall' Is Coming to NATO's Eastern Border
2025-04-22,unknown,Trump attacks Ukraine for not recognising Russian occupation of Crimea
2025-04-22,unknown,Leavitt: Trump not asking Ukraine to recognize Crimea
2025-04-22,abc-news,WATCH: What you need to know about REAL ID
2025-04-22,unknown,"Prince Harry, Meghan Markle bring back ‘abnormal’ security with 4-car motorcade for NYC outing"
2025-04-22,cbs-news,"Apr 23: CBS News 24/7, 1pm ET"
2025-04-22,financial-post,OPEC+ Tensions With Kazakhstan Boil Over Sending Oil Price Lower
2025-04-22,unknown,"‘The Strong Do What They Please’: Dr. Judith Herman on Trump, Trauma and Tyranny"
2025-04-22,unknown,Vance Outlines U.S. Plan for Ukraine That Sharply Favors Russia (New York Times)
2025-04-22,unknown,"Trump slams Zelenskyy for rejecting Ukraine-Russia negotiations, claims a deal was 'very close' (NBC News)"
2025-04-22,the-times-of-india,Yet another Pak attempt to globalise Kashmir issue timed with foreign visits
2025-04-22,unknown,Europe Ignored Lessons of History
2025-04-22,financial-post,"Bessent Says US Backs IMF and World Bank, While Calling for Reforms"
2025-04-22,unknown,Trump says Zelenskyy is prolonging war in Ukraine by resisting calls to cede Crimea to Russia (Associated Press)
2025-04-22,unknown,Zelensky's aide: Ukraine to stand firm on territorial integrity
2025-04-22,cbs-news,India retaliates against Pakistan after Kashmir attack kills 26
2025-04-22,cbs-news,Israeli strike in Gaza kills at least 10 as mediators work to end war
2025-04-22,the-jerusalem-post,"Trump envoy Witkoff is expected to meet Putin on Friday, Axios reports"
2025-04-22,unknown,UK Plots to Blot Out the Sun
2025-04-22,unknown,'Bloodbath': Lawyer watches as judge hits back at Trump's DOJ in hearing
2025-04-22,unknown,Tens of thousands pay their respects to Pope Francis ahead of funeral on Saturday
2025-04-22,unknown,Crypto mining campaign targets Docker environments with new evasion technique
2025-04-22,rt,US media names possible date for US envoy meeting with Putin
2025-04-22,fox-news,Trump says 'inflammatory' Zelenskyy statement on Crimea prolongs war with Russia
2025-04-22,unknown,Google Confirms Gmail Update—How To Keep Your Email Account
2025-04-22,unknown,".....and if elected, I will end this war in 24 hours. Oh...I won? 100 days ago? Fark it, let's dump this pig of an issue and call it a win [Asinine]"
2025-04-22,the-times-of-india,Officials try to get Ukraine peace talks back on track after Rubio no show
2025-04-22,al-jazeera-english,Trump slams Zelenskyy’s Crimea position as UK hosts Ukraine talks
2025-04-22,unknown,Corruption In Ukraine Spells Potential Trouble For Post-War Economic Rebuilding
2025-04-22,the-irish-times,A count in arrears – Frank McNally on a first-ever solo exhibition of the life and work of Casimir Markievicz
2025-04-22,unknown,Trump 'very close' to a deal on Ukraine war or very close to blaming Zelenskyy for the lack of one
2025-04-22,unknown,Moscow blocks 21 UK politicians from entering Russia
2025-04-22,the-times-of-india,Trump says Zelenskyy is prolonging war in Ukraine by resisting calls to cede Crimea to Russia
2025-04-22,the-irish-times,Trump claims Zelenskiy is making it ‘difficult to settle’ war in Ukraine
2025-04-22,unknown,Seoul comes looking for Europe’s rearmament cash
2025-04-22,unknown,Trump claims Zelenskyy is prolonging ‘killing field’ in Ukraine by refusing to cede Crimea to Russia
2025-04-22,unknown,"Before Blue Origin’s All-Female Flight, The Morning Show Sent a TV Anchor to Space"
2025-04-22,unknown,Trump Warns Ukraine’s Zelenskiy About Crimea in Blistering Rant
2025-04-22,unknown,Has Modi govt’s strategy in Kashmir backfired in the face of new global alliances?
2025-04-22,unknown,Fractured Families: A Second Trump Term Threatens Migrant Children
2025-04-22,abc-news-au,Trump says peace in Ukraine 'very close' as he attacks Zelenskyy
2025-04-22,the-irish-times,"Ireland cannot protect its waters alone, UN expert says"
2025-04-22,unknown,Trump Official Dismisses Concerns of Rubio Not Attending Russia-Ukraine Peace Talks: 'He Has a Tweet Out'
2025-04-22,unknown,India-Saudi refinery deal back on table: Will Aramco's third try finally click?
2025-04-22,unknown,'Why didn't they fight for it?' Trump shames Ukraine for letting Russia take Crimea
