date,source,title
2025-05-16,unknown,EU watches high-stakes presidential election in Romania
2025-05-16,unknown,Ireland are gone - but here are eight acts to keep an eye out for in the Eurovision final
2025-05-16,unknown,"Russian Demands for Peace in Ukraine May Be Draconian, But the Alternative for Kiev Is To Risk Capitulation"
2025-05-16,unknown,Here's What Happened Today: Saturday
2025-05-16,unknown,"World leaders, delegates set to attend Pope Leo XIV’s inaugural Mass"
2025-05-16,unknown,Audio Analysis: Eurovision Broadcaster Muted Sounds of Crowd Booing and Shouting “Free Palestine!”
2025-05-16,the-times-of-india,"Centre releases list of 50 MPs to lead India's voice globally post Operation Sindoor; Shashi Tharoor, Supriya Sule lead from Opposition"
2025-05-16,unknown,"Ovations for the Black, Gay, Trans graduate speaker who wants to kill the Jews"
2025-05-16,unknown,Key oppn leaders join Govt’s international outreach delegations after Op Sindoor
2025-05-16,the-times-of-india,"Lies, now open sourced: India-Pakistan conflict puts spotlight on open-source intelligence and credibility problem"
2025-05-16,unknown,Nine Ukrainians killed in brutal Russian drone attack following failed cease-fire talks
2025-05-16,unknown,Medvedev warns failed talks could bring wider war
2025-05-16,unknown,Russian Ground Forces get new commander
2025-05-16,unknown,Trump says he will call Putin on Monday to discuss stopping Ukraine war - BBC
2025-05-16,unknown,"Trump Complains to Baier That Zelensky, Ukraine ‘Pissed Away’ Billions Fighting Off Russia: ‘Congress is Very Upset!’"
2025-05-16,unknown,What Could Hold Up Real Progress in Russia-Ukraine Peace Talks in Istanbul?
2025-05-16,unknown,Kremlin confirms Putin-Trump phone talk in the works
2025-05-16,unknown,The American Daniel (aka Donald) in a lions' den
2025-05-16,unknown,Meeting the proud pro-Trumper who could be Romania's new president
2025-05-16,unknown,"Trump to speak with Putin, Zelenskyy on Monday - Politico"
2025-05-16,unknown,Baltic Doc Producers Trio to Track
2025-05-17,unknown,"Macron, Trump, Starmer, Merz, Meloni discuss war in Ukraine"
2025-05-17,unknown,Telegram founder ‘flatly refused’ to censor political content ahead of Romanian election
2025-05-17,unknown,Poles vote for new president as security concerns loom large
2025-05-17,unknown,Shwartzman shocks the field as he becomes 1st Indy 500 rookie since 1983 to win the pole
2025-05-17,the-irish-times,In a Word ... Scatology
2025-05-17,unknown,Britain poised to reset trade and defence ties with EU
2025-05-17,unknown,Liberal mayor Dan beats nationalist in tense race for Romanian presidency
2025-05-17,bbc-news,Romanian liberal mayor Nicusor Dan wins tense race for presidency
2025-05-17,unknown,Russia launches war's largest drone attack ahead of Putin-Trump call
2025-05-17,unknown,Centrist wins Romania's tense presidential race over hard-right nationalist
2025-05-17,unknown,Romania Holds Serve
2025-05-17,cbs-news,Tech billionaire Palmer Luckey wants to remake the U.S. military
2025-05-17,cbs-news,Tech mogul Palmer Luckey creating arsenal of AI-powered autonomous weapons
2025-05-17,the-jerusalem-post,I still trust my Israeli passport because I have faith in the Israeli people
2025-05-17,unknown,Paris Airport Cuts Flights by 40 Per Cent After Air Traffic Control Breakdown
2025-05-17,unknown,South Korea's presidential candidates face off in fiery debate
2025-05-17,unknown,Easing trade with the EU and a defence pact would be a much-needed win for Starmer
2025-05-17,unknown,"Britain may have to resort to anti-subversion laws, watchdog warns"
2025-05-17,unknown,‘Our foreign policy enables broad diplomatic ties’
2025-05-17,unknown,Rubio says 'we'll find out pretty soon' if Russia is 'tapping us along' in Ukraine talks (Elizabeth Crisp/The Hill)
2025-05-17,unknown,Putin heads into Trump call confident that Russia has upper hand
2025-05-17,unknown,"Liberal mayor and conservative historian headed to presidential runoff in Poland, exit poll shows"
2025-05-17,the-irish-times,Centrist Nicuşor Dan on course to win Romanian presidential election with 99% of votes counted
2025-05-17,unknown,Bessent acknowledges Trump’s tariffs may mean shoppers will pay more at Walmart
2025-05-17,unknown,Donald Trump Extends Wishes To Joe Biden For A “Fast And Successful Recovery”
2025-05-17,unknown,Wars And Rumors Of Wars: 4 Major Global Conflicts That Have Reached A Tipping Point
2025-05-17,unknown,Pro-EU centrist wins Romania’s tense presidential runoff over hard-right nationalist
2025-05-17,unknown,Putin Heads Into Trump Call Confident That Russia Has Upper Hand
2025-05-17,unknown,Bucharest Mayor Dan's Surprise Presidential Win Spells Relief For EU And NATO
2025-05-17,unknown,Former US Ambassador to Ukraine on why she left her post under President Trump
2025-05-17,unknown,"European Stocks: A Rich, And Cheap, Opportunity"
2025-05-17,unknown,How Zelensky is holding up after three years of battle...
2025-05-17,unknown,Pro-EU centrist wins tense Romania presidential vote...
2025-05-17,unknown,Russia unleashes war's biggest drone attack...
2025-05-17,unknown,Zelensky congratulates Romania's Dan on election victory
2025-05-17,unknown,JUST IN: Liberal Bucharest Mayor Nicușor Dan Set To Win Controversial Romanian Presidential Elections
2025-05-17,abc-news-au,Why is the Pope also the ruler of a country? Vatican City’s unique status explained
2025-05-17,nbc-news,Here's the biggest news you missed this weekend
2025-05-17,unknown,Romania Chooses EU Ally Over MAGA Supporter
2025-05-17,unknown,Tate bro tears and EU delight as Dan beats right-winger in Romania’s election
2025-05-17,abc-news-au,Albanese meets Zelenskyy and pope in Rome
2025-05-17,unknown,"UK's Starmer discussed Ukraine war with leaders of US, Italy, France and Germany, Downing Street says"
2025-05-17,unknown,Fears for Ukraine peace talks as Russian TV broadcasts Putin warning Donald Trump to stop trying to dictate terms
2025-05-17,unknown,Pope Leo XIV warns against exploitation at inaugural mass
2025-05-17,unknown,Pro-EU centrist wins Romania’s tense presidential race over hard-right nationalist
2025-05-17,financial-post,Five Key Charts to Watch in Global Commodity Markets This Week
2025-05-17,breitbart-news,Globalist Bucharest Mayor Secures Surprise Win over Populist Simion in Romanian Elections
2025-05-17,unknown,"Pope Leo XIV meets President Zelenskyy, recalls 'martyred Ukraine'"
2025-05-17,unknown,The Chattering Classes: Merz’s new spymaster?; Chatterbox of the month; Herr Dr. Döpfner goes to Washington; Just one word: ‘workflow’
2025-05-17,rt,France denies claims of Romanian election interference
2025-05-17,unknown,Interest rate cut almost certain as RBA sits for two-day meeting
2025-05-17,unknown,The Human Cost of Syria Sanctions
2025-05-17,unknown,The Shock of Waking Up in Carney’s Canada
2025-05-17,al-jazeera-english,Centrist Trzaskowski leads first round in Poland’s tight presidential poll
2025-05-17,unknown,Russia Unleashes One of Its Largest Drone Barrages of the Ukraine War (New York Times)
2025-05-17,rt,Flag display costs Russian runner recognition of world record
2025-05-17,unknown,Republicans look to get Trump’s big bill back on track with rare Sunday committee session
2025-05-17,unknown,Pro-EU Centrist Wins Romania’s Tense Presidential Race Over Hard-right Nationalist
2025-05-17,unknown,Russia’s Top Negotiator Outlines Key Outcomes of Istanbul Talks
2025-05-17,newsweek,Romanian Exit Polls Show Clear Winner as Rival Declares Victory
2025-05-17,unknown,Scott Bessent admits Trump’s tariffs may mean Walmart shoppers pay more
2025-05-17,nbc-news,"Pro-EU centrist in Romania’s tense presidential race takes lead, preliminary data shows"
2025-05-17,unknown,1 in 5 Gazans face starvation. Can the law force Israel to act?
2025-05-17,unknown,"‘Greenlandisation’, sea ice, permafrost: how polar words explain a changing world"
2025-05-17,unknown,Vance and Zelenskyy meet in Rome as Trump pushes for Ukraine peace deal
2025-05-17,unknown,Mike Pence: I've never been a fan of American presidents criticizing America on foreign soil.
2025-05-17,unknown,"[Ilya Somin] Bigotry, Hypocrisy, and Trump's Admission of Afrikaners as Refugees"
2025-05-17,unknown,Thailand Craft Cocoa 2025 kicks off today
2025-05-17,unknown,Russia Unleashes One of Its Largest Drone Barrages
2025-05-17,unknown,WNBA launches racism investigation after Angel Reese-Caitlin Clark clash
2025-05-17,cnn,"Romania’s pro-EU candidate has lead over hard-right nationalist, preliminary election data shows | CNN"
2025-05-17,unknown,Bessent Dismisses Moody’s Downgrade as ‘Lagging’ Indicator
2025-05-17,unknown,"Ukraine's Zelenskyy meets with U.S. officials, European leaders ahead of Trump-Putin call"
2025-05-17,unknown,Thunderbolts*: 10 Major Differences Between the Comics and the MCU
2025-05-17,unknown,US Vice President Vance discusses trade with Canada's Carney
2025-05-17,unknown,"Austria grappling with venue, funding for next Eurovision Song Contest"
2025-05-17,unknown,Ukraine Situation Report: Third F-16 Viper Lost
2025-05-17,the-irish-times,The Irish Times view on the UK/EU summit: a chance to undo some of the Brexit damage
2025-05-17,unknown,Dan Bongino gives his verdict on Jeffrey Epstein’s cause of death after reviewing FBI files
2025-05-17,unknown,RBA Poised for ‘Hawkish Cut’ as US-China Reprieve Boosts Outlook
2025-05-17,cbs-news,"Zelenskyy meets with U.S. officials, European leaders ahead of Trump-Putin call"
2025-05-17,unknown,Romanian centrist on course to beat pro-Russian candidate in presidential election turnaround
2025-05-17,fox-news,"Rubio teases details of potential Trump, Putin in-person meeting after Russia-Ukraine ceasefire talks stall"
2025-05-17,unknown,"Tusk Ally, Nationalist Head for Poland Runoff, Exit Poll Shows"
2025-05-17,unknown,Modi Could Get Cornered on Trade by the White House
2025-05-17,unknown,Marco Rubio Addresses if Russia Is 'Tapping Us Along' in Ukraine Talks
2025-05-17,breitbart-news,FBI Director Patel Says Transparency on Russia Collusion Claim in 'a Week or Two' — 'The Biggest D.C. Deception Game We Have Ever Seen'
2025-05-17,unknown,"Yuval Rafael landed in Israel: ""I returned with great feelings of pride"""
2025-05-17,unknown,Here's What Happened Today: Sunday
2025-05-17,the-irish-times,The Irish Times view on displaced people: a crisis rapidly worsening
2025-05-17,newsweek,Marco Rubio Addresses if Russia Is 'Tapping Us Along' in Ukraine Talks
2025-05-17,unknown,"FDA approves Novavax COVID-19 vaccine, but with unusual restrictions on its use"
2025-05-17,unknown,NYC Bankers Who Live in NJ Game Out Commute as Rail Strike Upends RTO Plans
2025-05-17,unknown,Investors Brace for Stock Futures to Trade After Moody’s Downgrade
2025-05-17,unknown,Billionaire fund manager unloads 600 million of Tesla stock
2025-05-17,unknown,Two more examples of the nationalist’s dilemma
2025-05-17,abc-news-au,Ukraine accuses Russia of targeting civilians in 'record' drone attack
2025-05-17,unknown,Romania election: Pro-EU centrist Nicusor Dan wins runoff
2025-05-17,unknown,Romania election: Candidates neck-and-neck - early results
2025-05-17,unknown,Zelensky Says He's Ready for Dialogue With Russia 'in Any Format'
2025-05-17,unknown,One Wrong Decision and Everything Turns to Dust
2025-05-17,unknown,Russia Unleashes One of Its Largest Drone Barrages of the Ukraine War
2025-05-17,unknown,Romanians brace for results as polls close in high-stakes presidential runoff
2025-05-17,unknown,"Buffett to Skip Stage at 2026 Annual Meeting, Omaha Paper Says"
2025-05-17,unknown,Looming economic disaster comes from ‘liability’ for ‘climate change’
2025-05-17,unknown,Poland votes in tight election as Europe watches
2025-05-17,unknown,Boycotting Target: A WSJ Podcast Series
2025-05-17,unknown,Zelenskyy meets with Vance and European leaders ahead of high-stakes Trump-Putin call
2025-05-17,unknown,Spectrum restores services in Kansas City after vandals cut fiber optic lines
2025-05-17,unknown,Bessent weighs in on tariff price hikes at Walmart
2025-05-17,unknown,Costco quietly makes payment change members will love
2025-05-17,unknown,Researchers discover the odd reason this ‘unusual’ mummy survived the centuries so well-preserved
2025-05-17,unknown,Russia seizes Greek-owned oil tanker in the Baltic Sea
2025-05-17,unknown,"Romania: Pro-EU centrist Dan ahead, exit polls show"
2025-05-17,unknown,"Romania: Pro-EU centrist Nicusor Dan ahead, exit polls show"
2025-05-17,unknown,Two New Renewable Energy Technologies That Just Might Work
2025-05-17,cbs-news,"Full transcript of ""Face the Nation with Margaret Brennan,"" May 18, 2025"
2025-05-17,unknown,Dan Bongino blasts James Comey over ‘86 47′ Instagram post: ‘brought shame to the FBI again’
2025-05-17,unknown,"Bucharest Mayor Takes Lead in Romanian Election, Exit Polls Show"
2025-05-17,unknown,"Tax Bill News; Target, Home Depot, and Snowflake Earnings; and More Stock Market News to Watch This Week"
2025-05-17,unknown,Ray McGovern Speaks in Moscow on Trust Between Russia and the US
2025-05-17,unknown,Liberal Bucharest mayor ahead of far-right candidate in Romanian presidential runoff
2025-05-17,unknown,Telegram founder says he rejected a Western request to silence conservative voices in Romania
2025-05-17,unknown,Romania election: Polls close in tight presidential runoff
2025-05-17,unknown,Media Hot Take: The Real Scandal Was the MSM’s Failure to Stop Trump’s Reelection
2025-05-17,unknown,Russia launches drone strike on Ukraine days after direct talks
2025-05-17,unknown,Researchers Uncover Horrors Of Russian ‘City Drowned In Blood’ By The Mongols In 1238
2025-05-17,the-irish-times,Russia launches 273 drones against Ukraine before Trump talks
2025-05-17,unknown,"Zelenskyy sheds details on meeting with Vance, Rubio in Rome after Russia peace talks stall"
2025-05-17,unknown,"Hungarians Protest 'Authoritarian' Bill Against NGOs, Media"
2025-05-17,unknown,"Hungarians protest ‘authoritarian’ bill against NGOs, media"
2025-05-17,rt,Ukrainian neo-Nazis to sign deal with Russian separatists
2025-05-17,unknown,Ben Frost – Under Certain Light and Atmospheric Conditions (2025)
2025-05-17,cbs-news,"Ex-Ambassador Bridget Brink says decision to resign ""wasn't a hard, a hasty, rash decision"""
2025-05-17,cbs-news,"Putin won't take peace with Ukraine without restoring empire, ex-Defense Secretary Gates says"
2025-05-17,unknown,Snubbed: Pope gives JD Vance just 17 seconds — but has long meetings with other leaders
2025-05-17,unknown,"Syberia Remastered announced for PS5, Xbox Series, and PC"
2025-05-17,unknown,Russia-Linked SpyPress Malware Exploits Webmails to Spy on Ukraine
2025-05-17,unknown,Operation Sindoor: How homegrown deftech mount a near-impregnable air defence
2025-05-17,unknown,Pope Leo XIV vows to work for unity so Catholic Church becomes a symbol of peace in the world
2025-05-17,unknown,Estonia Says Russia Detained A Tanker In Baltic Sea
2025-05-17,abc-news,Hungarians rally in mass protest against bill allowing blacklisting of Orbán critics
2025-05-17,al-jazeera-english,Russia detains Greek oil tanker after it departs Estonian port
2025-05-17,unknown,Zelensky Meets Vance As Russian Drones Pound Ukraine
2025-05-17,cbs-news,"Rubio says U.S. will find out if Russia is ""tapping us along"" amid push for Ukraine ceasefire"
2025-05-17,unknown,Vance And Zelenskyy Shake Hands In First Encounter Since Oval Office Meeting
2025-05-17,unknown,"Bridging the Gulf via trade, strategically"
2025-05-17,unknown,Europe races to influence Trump ahead of Putin call
2025-05-17,the-times-of-india,"Trump's tariffs may mean Walmart shoppers pay more, his treasury chief acknowledges"
2025-05-17,unknown,"Sen. Tim Kaine: Europeans Agree Putin Is Negotiating In Bad Faith, But They're Praising Trump For Trying"
2025-05-17,unknown,Romania accuses Russia of electoral interference
2025-05-17,unknown,The Tijuana River stinks. Let’s rename it after Trump
2025-05-17,breitbart-news,JD Vance Meets Pope Leo and Ukraine's Zelensky in Rome
2025-05-17,unknown,Pope Leo XIV vows to work for unity so that Catholic Church becomes symbol of peace
2025-05-17,the-times-of-india,Treasury secretary says Walmart's warnings on price increases are a 'worst-case scenario'
2025-05-17,fox-news,FBI’s top boss Kash Patel says bureau ran cover for Hillary but it all ends under Trump
2025-05-17,unknown,"Trump’s tariffs may mean Walmart shoppers pay more, his treasury chief acknowledges"
2025-05-17,unknown,U.S. envoy Witkoff predicts 'successful' call between Trump and Putin on Monday - ABC News
2025-05-17,unknown,"Russia Preparing 'Combat Training' ICBM Launch, Kyiv Warns"
2025-05-17,newsweek,"Russia Preparing 'Combat Training' ICBM Launch, Kyiv Warns"
2025-05-17,the-jerusalem-post,Britain holds first high-level military talks with Syria since 2011
2025-05-17,unknown,Pope Leo Snubs JD Vance After Inaugural Mass
2025-05-17,unknown,Estonia says Russia detained a tanker in Baltic Sea
2025-05-17,unknown,"Zelenskyy Meets U.S., EU Leaders In Rome Ahead Of Trump-Putin Call"
2025-05-17,unknown,"Russia launches largest drone attack after peace talks, Ukraine says"
2025-05-17,cbs-news,"Transcript: Former Ambassador Bridget Brink on ""Face the Nation with Margaret Brennan,"" May 18, 2025"
2025-05-17,unknown,Poland Votes For A New President As Security Concerns Loom Large
2025-05-17,unknown,1687 Destruction of the Parthenon [12:39]
2025-05-17,rt,France pressured Telegram to silence Romanian conservatives – founder
2025-05-17,unknown,Exit polls from Romanian election suggest surprise win for pro-Western candidate
2025-05-17,unknown,Treasury secretary says Walmart's warnings on price increases are a 'worst-case scenario'
2025-05-17,unknown,Someone Bought a Fraudulent Gift Card With My Amazon Account: Here's What I Did
2025-05-17,unknown,A More Effective Way to Confront China’s Growing Aggression
2025-05-17,unknown,Cooking up a golden meal for Malaysia
2025-05-17,al-jazeera-english,South Korea’s presidential candidates hold first heated debate
2025-05-17,unknown,How India’s prowess in space is its ‘fourth dimension’ of warfare
2025-05-17,fox-news,"Zelensky sheds details on meeting with Vance, Rubio in Rome after Russia peace talks stall"
2025-05-17,the-jerusalem-post,Estonian PM vows to keep up checks on Russia's 'shadow fleet'
2025-05-17,cbs-news,"Transcript: Former Defense Secretary Robert Gates on ""Face the Nation with Margaret Brennan,"" May 18, 2025"
2025-05-17,al-jazeera-english,"EU, UK leaders to speak with Trump before his Putin call as Ukraine hit"
2025-05-17,unknown,Vance & Zelensky Repair Relationship In 'Good' Vatican Meeting
2025-05-17,unknown,Merz Says He Plans to Talk to Trump Before His Potential Phone Call With Putin
2025-05-17,unknown,Witkoff Hopes Trump-Putin Call Will 'Clear Logjam' in Ukraine Talks
2025-05-17,unknown,Austria wants EU to woo Russia’s friends on Ukraine ceasefire
2025-05-17,unknown,"[Ilya Somin] Our Supreme Court Amicus Brief Opposing Termination of CHNV Immigration Parole, Which Would Make Subject Some 500,000 Legal Immigrants to the Risk of Deportation to Oppressive Regimes"
2025-05-17,unknown,Drag Show Owners Beat DeSantis in Court
2025-05-17,unknown,"Jakob Kolbeck, Managing Director, on How Field Demands Drive Innovation at Lindnerhof"
2025-05-17,unknown,Investors Await Another Monday Jolt After Moody’s Downgrades US
2025-05-17,unknown,Global Water Crisis: Russia’s Advantage as Shortages Loom
2025-05-18,rt,US should never have intervened in Ukraine – Trump
2025-05-18,unknown,"Trump: Russia, Ukraine to Begin Peace Talks Immediately"
2025-05-18,unknown,Trump-Putin call exposes shifting ground on Ukraine peace talks - BBC
2025-05-18,unknown,Oil Steadies With Focus on Russia-Ukraine and US-Iran Talks
2025-05-18,unknown,Trump's call with Putin exposes shifting ground on Ukraine peace talks
2025-05-18,unknown,"To end the war in Ukraine, make Beijing’s bankrolling of Russia’s war machine hurt"
2025-05-18,the-jerusalem-post,From asset to liability: The strategic price of Israel’s messianic turn
2025-05-18,abc-news,WATCH: Bald eagle and dog form unlikely bond in backyard of Washington home
2025-05-18,unknown,Tony Abbott’s position in Orbán’s Hungary is untenable
2025-05-18,unknown,Kremlin says Russia open to Vatican's offer
2025-05-18,fox-news,Navy's former second-in-command convicted in historic corruption case
2025-05-18,cbs-news,What came of Trump's 2-hour call with Putin?
2025-05-18,unknown,"Industrial Nitrocellulose Market to Reach USD 1.3 Billion by 2034, Growing at 5% CAGR | Exactitude Consultancy"
2025-05-18,unknown,ROOKE: Trump Just Got Permission To Say ‘¡Adiós!’ To Biden’s Posse
2025-05-18,unknown,Has Donald Trump abandoned Ukraine?
2025-05-18,fox-news,"President Trump confident Putin wants peace with Ukraine, thinks he's 'had enough' of war"
2025-05-18,breitbart-news,Report: Russian Economic Growth Plummets After Trump Takes Office
2025-05-18,unknown,UK and Ukraine hail scientists’ role in the fight for freedom
2025-05-18,unknown,News Wrap: Supreme Court allows Trump to end temporary protected status for Venezuelans
2025-05-18,unknown,CISA has a new No. 2 - but still no official top dog
2025-05-18,unknown,The Biden Cover-Up Scandal Just Got WORSE
2025-05-18,unknown,EU Likely to Propose to G7 Lowering Price Cap on Russian Oil to $50 per Barrel
2025-05-18,unknown,Israel allows ‘minimal aid’ into Gaza as it intensifies airstrikes and ground operations
2025-05-18,cbs-news,What we know about Trump's 2-hour phone call with Putin
2025-05-18,unknown,Trump Lets First Lady Melania Sign a Bill She Helped Champion Through Congress
2025-05-18,unknown,Trump’s warm welcome for white refugees was a diplomatic shot across South Africa’s bow
2025-05-18,unknown,Bloomberg Journalist Among Anti-Israel Radicals Arrested for Storming Columbia Library
2025-05-18,unknown,Putin just showed Trump how little he needs him
2025-05-18,unknown,Trump Says 'Of Course' He Asked Putin to Meet With Him
2025-05-18,cbs-news,Chicago's UI Health gives a second chance to severely wounded Ukrainian soldier
2025-05-18,unknown,Trump says Russia and Ukraine to ‘immediately’ talk peace deal after call with Putin
2025-05-18,unknown,"[Latest] Global Sustainable Pharmaceutical Packaging Market Size/Share Worth USD 343.01 Billion by 2034 at a 15.13% CAGR: Custom Market Insights (Analysis, Outlook, Leaders, Report, Trends, Forecast, Segmentation, Growth Rate, Value, SWOT)"
2025-05-18,breitbart-news,Poll: Majority Say 'Lowering the Cost of Living' Should Be Top Trump Priority
2025-05-18,the-jerusalem-post,Peace with the entire Middle East is on the table now
2025-05-18,unknown,"""Want To End War But Not Sure If Russia Is Ready"": Zelensky"
2025-05-18,unknown,Top 50 Most Subscribed YouTube Channels • Week Of 05/18/2025
2025-05-18,fox-news,"Hegseth reveals plans to counter China, stay ahead in arms race as Pentagon pivots to Indo-Pacific"
2025-05-18,unknown,JD Vance Meets Pope Leo at the Vatican
2025-05-18,unknown,"Europeans to pressure Russia with sanctions, Germany says"
2025-05-18,unknown,Trump hands Putin a win with retreat from Ukraine peace talks
2025-05-18,unknown,Trump is being 'played for a fool': conservative columnist
2025-05-18,unknown,Do Leftists Really Believe the Trump Family Wants Another Plane?
2025-05-18,unknown,Republicans vs. Reality
2025-05-18,fox-news,Fox News Politics Newsletter: Another High Court Win for Trump
2025-05-18,unknown,Putin's Still In Charge (Tom Nichols/The Atlantic)
2025-05-18,unknown,Trump 'surprised' public wasn't told about Biden's cancer diagnosis 'a long time ago'
2025-05-18,unknown,World Health Organization members vote in favor of global pandemic agreement
2025-05-18,bbc-news,Trump and Putin hold two-hour phone call on Ukraine
2025-05-18,unknown,Why I'm 'Very Skeptical' The Trump-Putin Phone Call Will Lead To A Lasting Ceasefire: FDD President
2025-05-18,unknown,Trump Touts ‘Excellent’ Call With Putin but Fails to Secure Cease-Fire
2025-05-18,unknown,"Trump Says Russia, Ukraine to ‘Immediately’ Begin Truce Talks"
2025-05-18,unknown,Piers Morgan Uncensored 2025.05.19 Part2 WEB H264-onX
2025-05-18,unknown,"New pro-European president in Romania puts it back on a Western course, but fault lines remain"
2025-05-18,unknown,Vance gives Pope Leo XIV an invitation from Trump to visit U.S.
2025-05-18,unknown,"UK and EU hail new chapter as they sign fresh deals, 5 years after Brexit"
2025-05-18,unknown,Trump says Russia-Ukraine ceasefire talks will begin immediately following call with Putin
2025-05-18,unknown,Trump: New Russia sanctions not impossible
2025-05-18,unknown,Trump: Big egos involved in Ukraine conflict
2025-05-18,unknown,G7 finance leaders to seek U.S. consensus on non-tariff issues at Canada meeting
2025-05-18,unknown,Cheetolini's big call with Putin went as expected. He achieved nothing [Followup]
2025-05-18,unknown,Trump says Vatican might host imminent Russia-Ukraine ceasefire talks
2025-05-18,unknown,Biden cost Democrats the 2024 election — but not in the way you think
2025-05-18,unknown,"Melania Trump signs bill outlawing revenge, AI-generated porn alongside husband Donald"
2025-05-18,unknown,"Zelensky says US should not distance itself from talks, as Russia says no timeline agreed (BBC)"
2025-05-18,unknown,Trump Hands Putin a Win With Retreat From Ukraine Peace Talks
2025-05-18,unknown,Zelenskiy Not Sure Russia Ready to End War After Trump-Putin Call
2025-05-18,unknown,Glenn: Tapper reveals Dems’ Biden health fraud
2025-05-18,unknown,"Russia and Ukraine to 'immediately' start ceasefire talks, says Trump"
2025-05-18,unknown,Poland seizes tires for Boeing aircraft headed for Russia
2025-05-18,unknown,Daily Press Briefing by the Office of the Spokesperson for the Secretary-General
