date,source,title
2025-05-01,newsweek,Marjorie Taylor Greene Rebukes Trump Admin Moves: 'Losing the Base'
2025-05-01,unknown,'Posterized!' Germany fires back as Rubio defends far-right party tied to Nazi slogans
2025-05-01,unknown,I Shouldn't Have to Tell You Not to Get Your News From Political Influencers
2025-05-01,the-jerusalem-post,Numerous White House personnel firings may come soon as next week
2025-05-01,unknown,ThinkCareBelieve: Week 15 of the Trump Administration
2025-05-01,rt,Ukrainian drone strikes house in southern Russia – governor (VIDEO)
2025-05-01,unknown,Ukraine upgrading F-16 fighter jet fleet as part of first US purchase under new minerals deal
2025-05-01,unknown,"Zero progress reported on Ukraine-Russia ceasefire, despite U.S. efforts"
2025-05-01,cbs-news,"Zero progress reported on Ukraine-Russia ceasefire, despite U.S. efforts"
2025-05-01,unknown,Ukraine troops to join British forces for VE Day procession
2025-05-01,the-times-of-india,"After LNG, government may hike fertiliser imports from US"
2025-05-01,fox-news,New report warns NATO's data vulnerabilities could cost lives without US fix
2025-05-01,unknown,US scores Ukraine minerals for AI & EVs
2025-05-01,business-insider,US scores Ukraine minerals for AI & EVs
2025-05-01,unknown,Top Yemeni official visits Washington seeking more U.S. support in fighting Houthis
2025-05-01,rt,Germany ‘has rebuilt the Berlin Wall’ – Vance
2025-05-01,unknown,"To force Putin to end his war on Ukraine, give Kyiv the weapons it needs"
2025-05-01,unknown,The deal provides a lifeline for the #economy as #Ukraine struggles with #war
2025-05-01,unknown,Soviet-era spacecraft from aborted Venus mission due to crash to Earth next week
2025-05-01,unknown,‘Gimmicks’: GOP lawmakers slam Trump’s ‘trillion-dollar’ defense-spending proposal
2025-05-01,unknown,"New York Times, Democratic Party Seek to Smother the Struggle Against Trump"
2025-05-01,unknown,"China, Hong Kong and The Art of Blinking"
2025-05-01,unknown,Margaret Mead Film Festival Offers New Yorkers a Chance to See Acclaimed Docs Without Distribution
2025-05-01,fox-news,"US readies Russia sanctions over Ukraine, unclear if Trump will sign, sources say"
2025-05-01,unknown,4 Cases Show DOGE and DOJ Are Cracking Down on Election Fraud
2025-05-01,unknown,"""$6100 Vintage Rolex!"": Sister Wives' Kody's Luxe Wristwatch & Other Timepieces Show His Lavish Lifestyle (Is He Spending Too Much Money On High-End Items Amid Coyote Pass Sale Windfall?)"
2025-05-01,unknown,"FAIR: Hey NPR, Free Speech Isn’t Just a Vibe"
2025-05-01,unknown,This 'narrative simulator' about a delivery driver in deeply rural Russia is giving me serious Mudrunner meets Disco Elysium vibes
2025-05-01,unknown,Russia Is Making Explosive Drones Out Of Toy Hoverboards
2025-05-01,unknown,US withdraws from formal Ukraine peace negotiations
2025-05-01,unknown,Harvard Accused of Training Chinese Officials Linked to Uyghur Abuses
2025-05-01,unknown,"We Needed a New President, Not ‘Comprehensive Immigration Reform’"
2025-05-01,newsweek,Milky Way's 'Dark River' Discovered in Ancient Egyptian Art
2025-05-01,unknown,Trump’s Ex-NatSec Advisor Savages Current Trump Envoy: ‘A Disaster in the Making’ Who ‘Doesn’t Know Anything’
2025-05-01,unknown,Trump’s Bold Strategy to Get a Ukraine War Peace Deal
2025-05-01,unknown,"Cardinal commemorates martyrdom, persecution of Eastern Catholics faithful to pope"
2025-05-01,unknown,"U.S.-led effort to end war in Ukraine looks favorable to Russia, but mixed signals emerge"
2025-05-01,unknown,What Trump’s New Budget Says About U.S. Foreign Policy
2025-05-01,unknown,"Greene furious over Ukraine minerals deal, Iran talks: 'The base is not happy' (Emily Brooks/The Hill)"
2025-05-01,unknown,Why Russia and China are Vying For Influence in Afghanistan
2025-05-01,nbc-news,U.S. Army is planning a parade for its anniversary — and Trump's birthday
2025-05-01,unknown,"Dave Hyde: Breathe in, breathe out, Big-Game Bob has Panthers’ back"
2025-05-01,unknown,"Concluding Annual Session, Permanent Forum Approves Draft Decisions Highlighting Importance of Culturally Suitable, Empowering Indigenous-Led Education"
2025-05-01,unknown,Marjorie Taylor Greene Rages at Republican Hawks: We Shouldn’t Bomb Iran On ‘Behalf of Other Countries’
2025-05-01,unknown,America’s Untold Stories -Trump’s First 100 Days: Triumphs and Turmoil
2025-05-01,the-jerusalem-post,"US readies Russia sanctions over Ukraine, unclear if Trump will sign, sources say"
2025-05-01,unknown,"Russian drones hit apartment block in Ukraine's Kharkiv, at least nine hurt"
2025-05-01,unknown,China ramps up global yuan push
2025-05-01,unknown,UK Reveals StormShroud Electronic Warfare Drone
2025-05-01,unknown,"US State Dept OKs possible sale of F-16 training, sustainment for Ukraine"
2025-05-01,unknown,Fantasy and Exploitation: The US-Ukraine Rare Earth Minerals Deal. The Trump-Zelensky Partnership
2025-05-01,abc-news-au,The wild and wacky moments that shaped the federal election campaign
2025-05-01,unknown,Daily Press Briefing by the Office of the Spokesperson for the Secretary-General
2025-05-01,unknown,Ireland’s DPC fined TikTok €530M for sending EU user data to China
2025-05-01,cnn,Harvard researcher detained in February for failing to declare frog embryo samples says she didn’t lie to government
2025-05-01,unknown,Arman Tsarukyan apologizes after ‘boring’ win at Karate Combat 54
2025-05-01,unknown,Cipher Mining Announces April 2025 Operational Update
2025-05-01,bbc-news,Trump to rename Veterans Day and VE Day as 'Victory' days
2025-05-01,the-irish-times,The Irish Times view on the Government’s first 100 days: lacklustre and listless
2025-05-01,unknown,What Will Happen to Russian-Occupied Territories in Ukraine?
2025-05-01,rt,Ukraine can’t reclaim lost territory – Rubio
2025-05-01,msnbc,Rubio's new role is a dangerous step in Trump's effort to consolidate power
2025-05-01,unknown,Germany's AfD dealt blow with right-wing extremist label
2025-05-01,unknown,May 2025 Reads for the Rest of Us
2025-05-01,unknown,Crude Drops Nearing 2021 Lows Amid Supply Surge
2025-05-01,unknown,'Not happy': Marjorie Taylor Greene hits GOP leaders with list of furious complaints
2025-05-01,unknown,US will no longer ‘fly around the world’ to negotiate an end to the Ukraine war
2025-05-01,unknown,The great deliverable of Trump’s first 100 days? Revenge
2025-05-01,unknown,"You’re Welcome, Romania: New U.S.-Made Patriot Air Defense Systems Inbound"
2025-05-01,breitbart-news,Hayward: Reporters Without Borders Whines About Trump While Giving Real Journalist Oppressors a Pass
2025-05-01,unknown,Donald Trump’s Ukraine minerals deals looks to be more about oil and gas than rare earths
2025-05-01,unknown,"Casting News: Josh Hutcherson’s HBO Comedy, Chicago Fire Vet’s New Role and More"
2025-05-01,unknown,Germany's AfD Dealt Blow With Right-wing Extremist Label
2025-05-01,unknown,Oil Falls as OPEC+ Weighs Another Major Production Increase
2025-05-01,abc-news-au,"The name's Chan, Jackie Chan — Bulgarian spies nabbed working for Kremlin"
2025-05-01,unknown,"Trump Getting Giant Military Parade, Roll Of Chuck E. Cheese Game Tokens On His Birthday"
2025-05-01,al-jazeera-english,ICJ hearing on Israel’s obligation to allow aid to Palestine: Key takeaways
2025-05-01,unknown,Ukraine: What are the benefits of the minerals deal with the US?
2025-05-01,abc-news-au,The campaign to 'poison' AI chatbots for Australians with pro-Russian propaganda
2025-05-01,unknown,Thunderbolts* Ending Explained: How Can a Team of Nobodies Defeat a God?
2025-05-01,unknown,GOP defense hawks in Congress slam Trump budget as inadequate
2025-05-01,unknown,"Trump Admits He Could Get Abrego Garcia Back, But Angrily Insists Non-Existent Tattoos Are The Reason He Won’t"
2025-05-01,unknown,"What is the biggest gaffe, blooper or blunder that a recent president has made? It may depend on what your definition of ‘is’ is"
2025-05-01,unknown,"What are the biggest gaffes, bloopers and blunders that recent presidents have made? It may depend on what your definition of ‘is’ is"
2025-05-01,unknown,What is the stupidest thing a recent president has said? It may depend on what your definition of ‘is’ is
2025-05-01,new-scientist,Disastrous back-to-back heatwaves and droughts surge across Eurasia
2025-05-01,unknown,Can't get no satisfaction in cyber recovery? Minimum viability is the answer
2025-05-01,unknown,Ghost Ships Skirt Sanctions in Venezuelan Oil Trade
2025-05-01,unknown,German Intelligence Officially Designates AfD an 'Extremist Organization' That Threatens Democracy
2025-05-01,unknown,Cell-Based Assays: The Future of Biomedical Breakthroughs
2025-05-01,unknown,"Modi commissions Vizhinjam seaport; says it will bring economic stability to Kerala, India"
2025-05-01,unknown,Trump’s Mineral Paradox
2025-05-01,unknown,China’s counter-UAV efforts reveal more than technological advancement
2025-05-02,cbs-news,"For America's European allies, Trump's first 100 days a time of reckoning, backlash"
2025-05-02,unknown,Europe marks VE Day with Trump on its mind
2025-05-02,rt,AI-generated Churchill reminds Starmer who crushed Nazi Germany in WW2 (VIDEO)
2025-05-02,unknown,What's it like to cover the war in Ukraine? NPR's Kyiv correspondent explains.
2025-05-02,unknown,호주 총선 집권 노동당 승리 21년 만에 첫 연임 총리
2025-05-02,unknown,Explosions sound in Ukraine's Kiev region
2025-05-02,unknown,Sean Penn Says Timely Drama ‘Words Of War’ Is A Five-Alarm Fire Warning
2025-05-02,financial-post,Trump Backlash Helps Australia’s Leader to Historic Re-Election
2025-05-02,unknown,'I will not do it again': Marjorie Taylor Greene threatens to withhold her vote from Trump
2025-05-02,unknown,"North Korea's Kim visits tank factory, touts progress in Korean-style tanks"
2025-05-02,unknown,Madeleine McCann family mark 18 years since disappearance
2025-05-02,bbc-news,Madeleine McCann family mark 18 years since disappearance
2025-05-02,nbc-news,Trump administration plans to cut thousands of employees at spy agencies
2025-05-02,unknown,News Wrap: Warren Buffett warns against U.S. using trade as a weapon
2025-05-02,unknown,World leaders respond to Prime Minister Anthony Albanese’s landslide Labor victory
2025-05-02,unknown,John Wayne Turned Down One Of Stanley Kubrick's Best Movies
2025-05-02,abc-news,WATCH: Boy has encounter with 'friendly' dolphin
2025-05-02,unknown,Japan ranks worst among G7 in 2025 world press freedom rankings
2025-05-02,unknown,Romanians vote in presidential test of Trump-style nationalism
2025-05-02,unknown,Hamas releases video of Israeli hostage as 11 killed in strikes on Gaza
2025-05-02,unknown,Russian drone attack wounds 47 in Ukraine’s second city of Kharkiv
2025-05-02,unknown,Border States Demand Changes to Ukraine Trade Deal
2025-05-02,the-jerusalem-post,Marion Fischel: Always finding her way back home to 'The Jerusalem Post'
2025-05-02,cbc-news,Remarkable scenes of gratitude greet Canadian war veterans in the Netherlands
2025-05-02,the-irish-times,Ukraine no to Russian call for three-day ceasefire to cover Moscow’s commemoration of end of second World War
2025-05-02,unknown,Top US figures visit Seoul to meet defense industry leaders
2025-05-02,unknown,Trump team has prepped options to pressure Russia to end war
2025-05-02,unknown,VE Day at 80: Lessons from wartime manufacturing for a modern Britain
2025-05-02,unknown,Russia and Ukraine clash over ceasefire proposals as fighting rages
2025-05-02,unknown,Pakistan will use 'full spectrum' of power in case of war
2025-05-02,unknown,Zelenskyy says won't play Putin 'games' with short truce
2025-05-02,unknown,Election of the Weekend III: Romania
2025-05-02,unknown,Zelensky Renews Plea to Allies After Russian Drones Wound 47
2025-05-02,the-times-of-india,"Pahalgam attack aftermath: Russia backs Simla Agreement, stresses bilateralism amid rising India-Pakistan tensions"
2025-05-02,unknown,King Charles and royals gather for military parade to mark VE Day anniversary
2025-05-02,unknown,WEEK 15 WINS: President Trump’s 100th Day Marked by More Success
2025-05-02,unknown,Another military first - Ukrainian drone shoots down Russian fighter plane in aerial combat [Interesting]
2025-05-02,unknown,GB beat Poland to seal World Championship promotion
2025-05-02,unknown,"Trump brands his opponents as ‘communists,’ a label loaded with the baggage of American history"
2025-05-02,unknown,Fears of global instability drive Singapore voters into ruling party's arms
2025-05-02,unknown,"Zelensky says talk with Trump was ‘the best’ so far, while US reportedly finalizes new sanctions on Russia"
2025-05-02,abc-news-au,It took just over two hours to call time on Dutton's two decades in politics
2025-05-02,unknown,Opinion: Irish people being against immigration is like Brazilian people being against football
2025-05-02,unknown,Trump’s AI photo in papal regalia breaks internet: ‘Seeing is believing’
2025-05-02,unknown,Europe’s Anti-American Shift: Now Globalists Are The Saviors Of The West?
2025-05-02,unknown,"POINT OF NO RETURN: Zelensky Rejects Victory Day Truce, Doubles Down on Threats to Moscow’s Parade Packed With Foreign Dignitaries – Russia’s Medvedev Hints at Nuclear Retaliation"
2025-05-02,rt,Pakistan will use ‘full spectrum of power’ if attacked – envoy
2025-05-02,the-times-of-india,"Zelenskyy snubs short truce, won't play Putin's 'games'"
2025-05-02,the-times-of-india,"Who is Marjorie Taylor Greene? Once a fierce trump ally, now turning against him"
2025-05-02,unknown,Donald Trump Birthday to Coincide With Massive Military Parade
2025-05-02,unknown,‘I Hate Black People’: Fans Shocked As Moniece Slaughter Blames Black People After Her Car Was Broken Into
2025-05-02,unknown,Hamas Armed Wing Releases Video Of Apparently Injured Israeli Hostage
2025-05-02,unknown,Hamas armed wing releases video of apparently injured Israeli hostage
2025-05-02,unknown,"Australia election: Anthony Albanese crushes rival Peter Dutton, opposition leader loses his seat"
2025-05-02,unknown,Anti-Semitism: The modern forces fueling an ancient scourge
2025-05-02,unknown,How Trump Offset U.S. Taxpayer Costs For Ukraine Aid Through Long-Awaited Minerals Deal
2025-05-02,unknown,"Tulsi Gabbard Confirms Investigation into Dr. Anthony Fauci, Origins of Covid"
2025-05-02,the-times-of-india,"Duolingo has millions of Indian users, but less than 1% pay: Luis von Ahn, CEO and cofounder"
2025-05-02,unknown,Serbian president stable in hospital after cutting short US trip
2025-05-02,unknown,Ukraine says it shot down Russian jet after Black Sea coast targeted
2025-05-02,unknown,Taxpayer-funded exhibition lionized Fauci
2025-05-02,unknown,MTG: ‘The Base Is Not Happy’ [Marjorie Taylor Greene]
2025-05-02,the-irish-times,‘We will leave no stone unturned’: Parents of missing Madeleine McCann mark 18th anniversary of her disappearance
2025-05-02,abc-news-au,Zelenskyy says talk with Trump at Vatican the 'best' they've had
2025-05-02,unknown,Scholz calls for European unity at World War II commemoration
2025-05-02,unknown,Russia Declares State Of Emergency At Port After Ukrainian Drone Attack
2025-05-02,the-times-of-india,Lavrov-Jaishankar conversation: Russia emphasises on bilateral pacts amid Pakistan’s effort to internationalise issue
2025-05-02,unknown,Zelensky says won't play Putin 'games' with short truce
2025-05-02,the-times-of-india,Declassified Russian documents reveal chilling new details of Hitler’s last hours
2025-05-02,unknown,Why tokenized gold beats other paper alternatives — GOLD DAO
2025-05-02,unknown,Ukraine Rejects Russian Call for a Three-Day Cease-Fire
2025-05-02,unknown,Rhysida Ransomware gang claims the hack of the Government of Peru
2025-05-02,unknown,"Ukraine Can't Ensure Safety of Xi Jinping, Other Leaders in Moscow—Zelensky"
2025-05-02,unknown,Hamas publishes sign of life from hostage Maxim Herkin
2025-05-02,the-jerusalem-post,What Europe can learn from Israel on the meaning of Remembrance Day
2025-05-02,newsweek,"Ukraine Can't Ensure Safety of Xi Jinping, Other Leaders in Moscow—Zelensky"
2025-05-02,the-times-of-india,"Big purge coming: After sacking Mike Waltz, Donald Trump plans to fire several White House staff; here are some names"
2025-05-02,unknown,Hamas releases second video of hostage Maxim Herkin from Gaza captivity
2025-05-02,unknown,Our Most Anticipated Queer Books for May 2025
2025-05-02,unknown,OPEC+ Stuns Market With Larger Than Expected Output Hike
2025-05-02,the-jerusalem-post,"Russian woman arrested for two months for suicide bomb plans, terror group support"
2025-05-02,rt,Ukrainian drone strikes Russian Orthodox church
2025-05-02,unknown,Kiev claims first ever sea drone takedown of Russian jet
2025-05-02,the-jerusalem-post,Hamas publishes propaganda video showing sign of life from hostage Maxim Herkin
2025-05-02,unknown,‘The Queen Got Taken Out!’ Trump Fan At Rally Goes On Bonkers Rant About Trump Taking Over Because Pope And Queen Died
2025-05-02,unknown,Ukraine minerals will be slowed by high risks and Soviet-era maps
2025-05-02,unknown,Zelensky: Ukraine cannot guarantee security at Moscow's WWII parade
2025-05-02,unknown,Serbian president hospitalised after cutting short US trip
2025-05-02,rt,Russia urges India and Pakistan to resolve tensions through diplomacy
2025-05-02,unknown,Russia’s Tanks Are Being Pummeled in Ukraine. Can New T-90s Stop the Bleeding?
2025-05-02,the-american-conservative,Waltz’s Demotion Should Begin a Neocon Purge
2025-05-02,rt,Moscow responds to Zelensky’s Victory Day threats
2025-05-02,unknown,US Elites Learned Much From the Vietnam Defeat
2025-05-03,unknown,Romania election: Hard-right George Simion wins 1st round
2025-05-03,unknown,"OPEC+ to further speed up oil output hikes, sources say"
2025-05-03,unknown,Mikko Rantanen registers first NHL Stanley Cup Playoff hat trick
2025-05-03,unknown,"Patriot air-defense system based in Israel to be refurbished, sent to Ukraine –"
2025-05-03,cbs-news,How Trump presidential orders targeting law firms impact the rule of law
2025-05-03,unknown,"China’s Xi Jinping to pay official visit to Russia, alongside Victory Day celebrations - AP News"
2025-05-03,financial-post,Oil Sinks as OPEC+ Supply Surge Threatens to Swamp Global Market
2025-05-03,unknown,"Meet George Simion, the hard-right Romanian election winner who’s banned from Ukraine - politico.eu"
2025-05-03,unknown,"‘Frankfurt Fellowship Network’ Combines Fellows, Invitation Program"
2025-05-03,unknown,Putin says he hopes Russia will not need to use nuclear weapons in Ukraine
2025-05-03,abc-news,Video Some cardinals in the running for pope have been ‘critical of Francis’: Martin
2025-05-03,unknown,Tammy Duckworth Says Mike Waltz Will Have 'Brutal' Confirmation Hearing For U.N. Ambassador
2025-05-03,unknown,Katie Ledecky and Gretchen Walsh set swimming world records in Florida
2025-05-03,unknown,Zelensky says does ‘not believe’ Russian truce pledge
2025-05-03,the-jerusalem-post,The isolationism in the United States leaves a vacuum in the Middle East for China
2025-05-03,unknown,Hard-right candidate secures victory in 1st round of Romania’s presidential election redo
2025-05-03,unknown,Putin says Russia has the 'strength and means' to finish war in Ukraine
2025-05-03,rt,Anti-Ukraine politician wins first round of Romanian presidential election rerun
2025-05-03,unknown,News Wrap: Trump wants to continue mass deportations despite Supreme Court ruling
2025-05-03,cnn,Russia’s Putin says he hopes there will be no need to use nuclear weapons in Ukraine | CNN
2025-05-03,unknown,Name that State!
2025-05-03,unknown,Strategic implications of North Korea’s expanding naval ambitions
2025-05-03,newsweek,Jasmine Crockett Reacts to Donald Trump Calling Her a 'Low IQ Person'
2025-05-03,unknown,VE Day 2025 latest: King Charles and royal family to show ‘united front’ for 80th anniversary celebration
2025-05-03,unknown,Trump Says May Use Military Force to Annex Greenland
2025-05-03,the-jerusalem-post,Russia says willing to help resolve India-Pakistan differences over Kashmir
2025-05-03,unknown,Putin says he hopes there will be no need to use nuclear weapons in Ukraine
2025-05-03,unknown,Screaming US tourist impaled on Rome’s Colosseum fence while possibly seeking selfie in horrifying scene
2025-05-03,unknown,Putin shows off home chapel and favourite drink in bizarre Kremlin tour… and admits he ‘fights urge to punch people’
2025-05-03,unknown,Putin says he ‘hopes’ no need to nuke Ukraine
2025-05-03,unknown,Chevron CEO warns against company’s possible departure from Venezuela amid negotiations with Trump admin
2025-05-03,unknown,"Meet George Simion, the hard-right Romanian election winner … who’s banned from Ukraine"
2025-05-03,unknown,MAGA-Style Candidate Leads in Romanian Revote
2025-05-03,unknown,The New Control Society
2025-05-03,newsweek,Trump's $36 Billion Army Reform: What 'Generational Change' Looks Like
2025-05-03,unknown,All the right moves - Trump’s first 100 days
2025-05-03,unknown,Putin Ally Who Unveiled Tesla Cybertruck With Machine Gun Now Says Elon Musk 'Remotely Disabled' The Militarized EV
2025-05-03,unknown,Russia says willing to help resolve India-Pakistan differences over Kashmir
2025-05-03,unknown,Ukraine drone takes out Russian fighter jet over Black Sea for first time: Kyiv
2025-05-03,the-irish-times,The Irish Times view on Ireland’s wind energy: opportunity must not slip past
2025-05-03,unknown,"Trump says he could 'walk away' from Russia-Ukraine talks, cites 'tremendous hatred' on both sides (Fox News)"
2025-05-03,unknown,Trump still would like to add Canada and Greenland but says attack on Canada ‘highly unlikely’
2025-05-03,unknown,Joe Rogan Won’t Work UFC 315: Dominick Cruz Steps In
2025-05-03,cbs-news,"Trump on using military force says ""I don't see it with Canada"""
2025-05-03,breitbart-news,"Chevron CEO Downplays Recession Threat, Praises Trump, Urges Caution over Chinese Influence in Venezuela"
2025-05-03,al-jazeera-english,Putin expresses ‘hope’ that nuclear weapons will not be needed in Ukraine
2025-05-03,unknown,Marco Rubio Says Uncle Sam Is Monitoring Social Media. Who Doesn’t Believe Him?
2025-05-03,rt,India said to have cut water flow to Pakistan – media
2025-05-03,unknown,"The Enemy of My Enemy Is My…Oh, Never Mind"
2025-05-03,unknown,"Michigan Newspapers, Florida Newspapers, Cryptomining, More: Sunday Afternoon ResearchBuzz, May 4, 2025"
2025-05-03,unknown,Romania election: Hard-right George Simion leads exit polls
2025-05-03,the-times-of-india,"'Need partners, not preachers': EAM S Jaishankar hits out at Europe"
2025-05-03,unknown,Trump's former VP Mike Pence to receive JFK Courage Award
2025-05-03,unknown,Here's What Happened Today: Sunday
2025-05-03,unknown,Bruce Springsteen Calls ‘Adolescence’ Star Stephen Graham ‘Amazing’ as His Father in ‘Deliver Me from Nowhere’
2025-05-03,unknown,First Image Of Ukraine’s Sidewinder-Armed Magura V7 Surface Drone - navalnews.com
2025-05-03,the-times-of-india,"India looking for partners, not preachers: EAM Jaishankar's swipe at Europe"
2025-05-03,unknown,Is This the Man Behind Trump’s China Policy? Mike Whitney
2025-05-03,unknown,UF softball on rise heading into SEC tourney
2025-05-03,unknown,Putin shows off gym and juicer on tour around his private apartment
2025-05-03,unknown,Exit polls: Far-right Simion to advance as Romania set for tense presidental run-off
2025-05-03,unknown,"Putin Says Russia Has the Forces and Resources To Bring the War in Ukraine to a ‘Logical Conclusion’, Hopes to Never Have To Use Nuclear Weapons"
2025-05-03,cbc-news,Romania voting in redo election after previous ballot voided over alleged Russian meddling
2025-05-03,unknown,Russia Alone in Confronting Entire Collective West - Putin
2025-05-03,unknown,President Trump Announces He Will Build a World Class Ballroom at the White House and Pay for It Himself with His Money and Private Donations
2025-05-03,unknown,Breathtaking Remarks from Dem Leaders Reveal Precisely Why Party Is in the Wilderness
2025-05-03,unknown,Putin ‘hopes’ Russia won’t have to nuke Ukraine as he brags on state TV about ‘logical conclusion’ of war
2025-05-03,unknown,Indian Air Force Fighters Operate from Highway Amid Mounting Tensions with Pakistan
2025-05-03,newsweek,MAGA Cheers Sovereignty Beating Journalism at Kentucky Derby—'Providential'
2025-05-03,espn,Timeline of Kane's trophy pain as Bayern title ends long wait
2025-05-03,unknown,Ukraine strikes factory in Russia's Bryansk region
2025-05-03,rt,Immortal Regiment marches honoring WWII heroes held across globe (VIDEOS)
2025-05-03,unknown,New Canadian Prime Minister Mark Carney must chart a new course on Palestine
2025-05-03,unknown,Looking back on President Trump’s first 100 days in office
2025-05-03,unknown,Running Influencer Gets Backlash For TikTok With Trump’s Press Secretary
2025-05-03,unknown,More American Air Defense Is on the Way to Help Ukraine - The New York Times
2025-05-03,unknown,JD Vance Gives Dumbest Answer Ever When Asked About AI Image Of Trump As Pope
2025-05-03,unknown,Putin says he 'hopes' nuclear weapons 'will not be required' in Ukraine (Rachel Scully/The Hill)
2025-05-03,cbs-news,"Full transcript of ""Face the Nation with Margaret Brennan,"" May 4, 2025"
2025-05-03,unknown,"Ukraine said 120,000 useless mortar rounds were sent to its front line after a manufacturer tried to cut costs"
2025-05-03,unknown,Letters: Why social media and politics can be a bad mix; Do we really need so many associate ministers?
2025-05-03,unknown,Dominick Cruz replaces Joe Rogan on broadcast team for UFC 315
2025-05-03,unknown,More American Air Defense Is on the Way to Help Ukraine
2025-05-03,unknown,Liberal win in Canada’s election upsets Israel supporters
