date,source,title
2025-05-08,unknown,"Exclusive: Iran to send Russia launchers for short-range missiles, sources say (Reuters)"
2025-05-08,the-times-of-india,"Insurance cos dread IPL cancellation, airlines & shipping lines premium hike amid an undeclared war scenario"
2025-05-08,the-times-of-india,"Insurance cos dread IPL cancellation, airlines & shipping lines premium hike"
2025-05-08,fox-news,Gavin Newsom removes ad after being knocked for using Ukraine footage while bragging about California
2025-05-08,unknown,India must choose its own path for a stronger and more equitable future
2025-05-08,unknown,Quick take: Hopeful signs that Pope Leo XIV is no Francis
2025-05-08,unknown,Here's What Happened Today: Friday
2025-05-08,unknown,Putin Pledges Victory in Ukraine
2025-05-08,unknown,What Role For China In Ukraine?
2025-05-08,breitbart-news,Pro-Russian Communists Unveil Bust of Stalin in Occupied Ukrainian City
2025-05-08,the-jerusalem-post,"Iran to send Russia launchers for short-range missiles, sources say"
2025-05-08,unknown,"U.S., China Prepare for High-Stakes Trade Talks in Geneva"
2025-05-08,unknown,The Ornate Sword That Napoleon Commissioned In 1802 Is Set To Fetch $1 Million At Auction
2025-05-08,msnbc,Why Canada's prime minister may prove the perfect Trump foil
2025-05-08,unknown,Does Team Trump Have The ‘Winning Hand’ It Needs To Break China’s Back In Looming Trade Talks?
2025-05-08,time,World Leaders Call on Pope Leo XIV To Continue Francis’s Climate Legacy
2025-05-08,unknown,Stratolaunch’s Hypersonic Plane Breaks Mach 5 and Lands Without a Pilot
2025-05-08,unknown,A Bronze Tribute to Motherhood Rises in Prospect Park
2025-05-08,rt,Ukrainian forces attempted to breach border four times during Moscow’s Victory Day truce – MOD
2025-05-08,unknown,Trump says no planned meeting with Putin in Saudi Arabia
2025-05-08,unknown,What in the World?
2025-05-09,unknown,"Putin says Russia is 'committed' to direct talks with Kyiv, suggests May 15 start"
2025-05-09,the-jerusalem-post,Fifty years of impact: BGU’s Faculty of Health Sciences sets the standard
2025-05-09,the-jerusalem-post,"The Iran deal reversal: For Netanyahu, it was never really about security"
2025-05-09,unknown,Putin suggests Russia and Ukraine have 'direct' talks next week
2025-05-09,bbc-news,Zelensky says Russia considering end to war a 'positive sign'
2025-05-09,unknown,"Putin proposes direct talks with Ukraine in Istanbul on May 15, 'without preconditions"
2025-05-09,nbc-news,"Putin says Russia is 'committed' to direct talks with Kyiv, suggests May 15 start"
2025-05-09,unknown,Putin proposes direct peace talks with Ukraine after three years of war
2025-05-09,unknown,Zelenskyy cautious after Putin proposes direct peace talks with Ukraine
2025-05-09,unknown,Putin offers 'direct' talks with Ukraine on May 15
2025-05-09,unknown,FBI Deputy Director Bongino Posts Update on X Assuring MAGA Supporters “On Some Things That I Think Are Going Well”
2025-05-09,unknown,Russia's Putin proposes direct talks with Ukraine
2025-05-09,unknown,Is Shell Sizing Up Oil’s Biggest Power Grab Yet?
2025-05-09,rt,Putin offers Ukraine direct talks without preconditions
2025-05-09,the-jerusalem-post,Putin proposes direct talks with Ukraine on May 15
2025-05-09,the-jerusalem-post,A demilitarized Palestinian state is a dangerous illusion
2025-05-09,unknown,Europe Threatens Nord Stream 2 Sanctions to Pressure Russia to Cease Fire - WSJ
2025-05-09,unknown,In Photos: Russia Marks 80 Years Since Soviet WWII Victory With Grandiose Military Parade - The Moscow Times
2025-05-09,cbs-news,"Ukraine, allies push for 30-day ceasefire with Russia"
2025-05-09,unknown,Putin Delivers Major Address Following Victory Day Diplomatic Marathon
2025-05-09,rt,WATCH LIVE: Putin delivers address after Victory Day talks with world leaders
2025-05-09,unknown,The 3-day Russia-Ukraine ceasefire ends
2025-05-09,unknown,Soviet-era spacecraft plunges to Earth after 53 years stuck in orbit
2025-05-09,unknown,Just five minutes of exposure to junk food advertising per day makes children eat more...
2025-05-09,unknown,‘Nonnas’: behind the filming locations for the Netflix comedy
2025-05-09,unknown,FBI’s Dan Bongino posts update on agency’s work under Trump
2025-05-09,unknown,European High-Tech Consortium Secures Funding from the European Defence Fund to Develop Multipurpose Unmanned Ground Systems
2025-05-09,unknown,Why Arsenal opted against signing Khvicha Kvaratskhelia in 2022
2025-05-09,unknown,News Wrap: European leaders push Russia for full ceasefire in Ukraine
2025-05-09,the-times-of-india,Ukraine and allies urge Putin to commit to a 30-day ceasefire or face new sanctions
2025-05-09,the-jerusalem-post,'The Hamas Intelligence War against Israel': Do terrorists read the 'Post'?
2025-05-09,cbc-news,"As Trump heads to the Middle East, fixing explosive crises takes a back seat to deal-making"
2025-05-09,the-jerusalem-post,Turkey's regional ambitions can only be stopped by building a Kurdish nation
2025-05-09,bbc-news,India and Pakistan accuse each other of ‘violations’ of ceasefire deal
2025-05-09,unknown,"Kyiv ceasefire talks mark a 'significant moment', says Starmer - BBC"
2025-05-09,unknown,Russia: Person injured in Ukrainian drone attack on Belgorod region
2025-05-09,cbs-news,Five fishermen who spent 55 days adrift at sea arrive in the Galapagos Islands
2025-05-09,unknown,Trump’s New Weaponization Czar Ed Martin Unleashes Hell on Deep State — Quietly Investigates Russiagate Architects and Lawfare Operatives Including Weissmann
2025-05-09,abc-news-au,How India and Pakistan's military and nuclear capabilities compare
2025-05-09,abc-news,WATCH: Nashville Zoo announces birth of tiny southern pudu
2025-05-09,abc-news,WATCH: Animals react as earthquake rattles Tennessee
2025-05-09,unknown,Ukraine demands 30-day truce backed by allies including US
2025-05-09,rt,China labels Xi’s Moscow visit ‘a complete success’
2025-05-09,unknown,European leaders tell Putin to agree to Ukraine ceasefire or face new sanctions
2025-05-09,unknown,"Trump, European leaders threaten ‘massive’ sanctions if Putin doesn’t accept 30-day cease-fire by Monday"
2025-05-09,rt,EU state leader hails ‘extremely successful’ Moscow visit
2025-05-09,financial-post,US Inflation Starting to Stir as Trump Tariff Threat Looms
2025-05-09,unknown,Are the Chinese Preparing to Take Over U.S. Oil Assets in Venezuela?
2025-05-09,abc-news-au,Soviet spacecraft Kosmos 482 plunges to Earth after 53 years in orbit
2025-05-09,unknown,Sweden tipped to beat Ireland's record and everything else you need to know about Eurovision
2025-05-09,unknown,What challenges await Pope Leo?
2025-05-09,unknown,"Kyiv ceasefire talks a 'significant moment', says Starmer"
2025-05-09,unknown,Greatest movies of all time
2025-05-09,unknown,"France in talks with Britain, Ukraine about potential troops, Macron tells paper"
2025-05-09,rt,Moscow says it won’t be pressured over Ukraine 30-day truce
2025-05-09,unknown,India and Pakistan ceasefire agreement in jeopardy after cross-border shelling - The Guardian
2025-05-09,unknown,"Putin Parades China, North Korea Ties in Victory Day Show of Force - WSJ"
2025-05-09,unknown,"The founders fought tyrants, the morbidly rich, religious elites. Remind you of anyone?"
2025-05-09,unknown,Putin: Situation in Gaza continues to deteriorate
2025-05-09,unknown,Chinese Foreign Minister Calls Xi's Visit to Russia 'Complete Success'
2025-05-09,unknown,Here's What Happened Today: Saturday
2025-05-09,the-times-of-india,Myanmar junta chief meets China's Xi for first time: state media
2025-05-09,unknown,Trump's Energy Policies Are Set to Significantly Boost U.S. Emissions
2025-05-09,unknown,What’s Next on Russia Sanctions If Putin Balks at Ceasefire Call
2025-05-09,unknown,Trump Eyeing Nuclear Deal With Saudi Arabia? China and Russia Watch Closely
2025-05-09,unknown,European leaders win Trump’s support to pressure Putin into unconditional ceasefire - politico.eu
2025-05-09,unknown,"Vladimir, stop!: Ukraine’s European backers challenge Putin to commit to a 30-day ceasefire"
2025-05-09,rt,Ukraine’s European backers can’t replace US military aid – NYT
2025-05-09,unknown,UFC 315 Results: Muhammad Vs. Della Maddalena Fight Card Early Prelims
2025-05-09,unknown,Pope Leo XIV lays out his vision and identifies AI as a main challenge for humanity
2025-05-09,unknown,What lies ahead for the new German government?
2025-05-09,unknown,Zelensky: Ukraine ready for talks in any format
2025-05-09,newsweek,Full List of Fox News Personalities Serving in Donald Trump Administration
2025-05-09,unknown,Low Fat Goat Milk Market and the Impact of Geo-Targeted Marketing
2025-05-09,the-times-of-india,"What is Donald Trump's Golden Dome that has sparked a debate in America, is it symbolic patriotism or a costly vanity megaproject?"
2025-05-09,unknown,"“When we came to England, all the headlines said: ‘Crash-boom-blitzkrieg, the Krauts are here!’”: The epic story of the Scorpions, the German band who smashed through the barriers to conquer America"
2025-05-09,unknown,What Was Behind Tiger Woods's Surprise Visit to the White House?
2025-05-09,unknown,Ukraine and European allies urge Putin to commit to 30-day ceasefire or face new sanctions
2025-05-09,unknown,Ukraine: European leaders pressure Russia over 30-day ceasefire - BBC
2025-05-09,unknown,Death by Impunity in Gaza: Perspectives on NAKBA 1948 (نكبة) and NAKBA 2023-?
2025-05-09,unknown,"Europeans leaders meet Zelensky in Kiev, press Russia for 30-day cease-fire"
2025-05-09,unknown,"Ascension reveals personal data of 437,329 patients exposed in cyberattack"
2025-05-09,unknown,DONALD TRUMP: MAN OF PEACE!
2025-05-09,unknown,Kremlin on Putin-Merz meeting: Ready for contacts
2025-05-09,unknown,Google Uncovers 'LostKeys': New Russian Malware in Action
2025-05-09,unknown,Soviet-era spacecraft hits Earth after 53 years stuck in orbit
2025-05-09,unknown,Joint Stock Company Kaspi.kz (KSPI): A Bull Case Theory
2025-05-10,unknown,PM 'toughens migration rules' and Zelensky ready to 'face Putin'
2025-05-10,unknown,"Israeli strikes on Gaza kill 11 people, mostly women and children"
2025-05-10,unknown,Russia: Man injured in Ukrainian drone attack on Belgorod region
2025-05-10,unknown,"Trump’s weaponization czar hints at international targets, accepts that GOP killed his DC US Attorney  nomination: ‘It worked out great’"
2025-05-10,cbs-news,"Pope Leo XIV gives first Sunday address, calls for peace in Ukraine and Gaza"
2025-05-10,cbs-news,Steve Rosenberg: One of the only Western journalists still working in Russia
2025-05-10,unknown,UK to Unveil New Russia Sanctions as European Ministers Meet
2025-05-10,unknown,"Stocks, dollar gain on US-China trade talks, detail needed"
2025-05-10,unknown,UK to host EU foreign ministers on defence and Ukraine before summit
2025-05-10,unknown,The rare disease in a remote town where 'almost everyone is a cousin'
2025-05-10,unknown,Why Burkina Faso's junta leader has captured hearts and minds around the world
2025-05-10,cbs-news,Crime rings using stolen identities to steal money from U.S. government
2025-05-10,cbs-news,The fraud costing the federal government hundreds of billions a year
2025-05-10,unknown,"1923 Alum Helen Mirren Compares Cara to MobLand’s Maeve: ‘Two Sides of a Coin, You Know?’ Plus: Her Take on That Harrigan Death"
2025-05-10,the-jerusalem-post,Israel must consider if it can rely on Trump whose choices seem driven by personal gain
2025-05-10,unknown,Tourism in the doldrums
2025-05-10,unknown,Time spent in Europe gave me perspective on the U.S. and our stocks
2025-05-10,unknown,트석열 계엄과 관세 여파 피부로 와 닿는다
2025-05-10,unknown,"Starmer, under pressure from Farage, tightens UK migration rules"
2025-05-10,unknown,"In first Sunday blessing, Pope Leo XIV calls for Gaza ceasefire, release of hostages - The Times of Israel"
2025-05-10,unknown,"Steven Joel Gitomer, 1943 -2025"
2025-05-10,unknown,Trump’s Ukraine push coming to a head with challenge to Putin
2025-05-10,unknown,"May 11, 2025 – PBS News Weekend full episode"
2025-05-10,unknown,Trump tariffs and US Imperialism
2025-05-10,nbc-news,Here's the biggest news you missed this weekend
2025-05-10,unknown,Pope Leo XIV calls for peace in Gaza and Ukraine in his first Sunday address as pontiff
2025-05-10,unknown,Zelenskyy agrees to meet Putin after Trump post; unclear if Russian president will join (Tom Balmforth/USA Today)
2025-05-10,unknown,News Wrap: Hamas says it will release hostage Edan Alexander
2025-05-10,unknown,Trump’s Ukraine Push Coming to a Head With Challenge to Putin
2025-05-10,unknown,Zelensky Agrees to Meet Putin
2025-05-10,unknown,"Russia burned down Warsaw’s biggest mall, Tusk says"
2025-05-10,the-jerusalem-post,Macron's eastward shift may spark Middle East anti-colonial revolt
2025-05-10,unknown,New Pope Leo XIV’s brother shared gross post calling Nancy Pelosi a ‘drunk c—‘
2025-05-10,bbc-news,Zelensky says he will meet Putin for talks
2025-05-10,unknown,Poland blames Russian intelligence for arson attack on Warsaw shopping center last year
2025-05-10,unknown,"UK hails India-Pak ceasefire, calls for sustained de-escalation"
2025-05-10,unknown,"Pope Leo XIV calls for peace in Ukraine and Gaza, and offers a Happy Mother's Day"
2025-05-10,unknown,Zelenskyy hopes for ceasefire with Russia and says he'll be 'waiting for Putin' in Turkey personally
2025-05-10,unknown,Zelensky to travel to Turkey for potential talks with Putin - Axios
2025-05-10,unknown,"Pope Leo XIV calls for peace in Gaza and Ukraine, saying 'Never again war' - NPR"
2025-05-10,unknown,Poland Accuses Russia of Arson Attack on Warsaw Shopping Complex
2025-05-10,unknown,'No more war': Pope uses first blessing to call for peace in Ukraine and Gaza
2025-05-10,unknown,Ed Husic hits back as Albanese finalises new cabinet
2025-05-10,unknown,Trump Presses Ukraine to Accept Putin's Proposal for Talks
2025-05-10,unknown,Poland blames Russia for 2024 Warsaw shopping centre fire
2025-05-10,unknown,GOP Rep Calls ICE Threat to Arrest Democrat Reps ‘Very Drastic’: ‘We Can Peacefully Protest In This Country’
2025-05-10,cnn,Poland blames Russian intelligence for arson attack on Warsaw shopping center last year | CNN
2025-05-10,unknown,Nottingham Forest owner confronts manager on pitch
2025-05-10,unknown,Macron Suffers Embarrassing Moment During Train Ride Into Ukraine (VIDEO)
2025-05-10,unknown,"Gaza, Ukraine and China: Trump sets up week that could define his presidency"
2025-05-10,unknown,German Censorship Highlights Europe's Eroding Free Speech Protections
2025-05-10,unknown,Zelensky vows to meet 'personally' with Putin for talks to end war
2025-05-10,unknown,Frederik Andersen records fourth career NHL playoff shutout
2025-05-10,unknown,Pindi's Fund Managers: How Washington keeps writing cheques to Pakistan through IMF
2025-05-10,the-times-of-india,"Constitution is supreme, asserts CJI-designate B R Gavai, says no to post-retirement assignment"
2025-05-10,unknown,"Zelenskyy tells Putin to come to Türkiye if he wants talks, after Trump intervention"
2025-05-10,time,"Hamas Says Edan Alexander, Last Living American Hostage in Gaza, Will Be Released as Part of Cease-Fire Efforts"
2025-05-10,the-irish-times,Convicted Real IRA bomber speaks at event marking 80th anniversary of VE Day
2025-05-10,unknown,Zelenskiy says: I am ready to meet Putin in Turkey on Thursday - Reuters
2025-05-10,breitbart-news,Exclusive -- Nate Morris: Mitch McConnell's 'Legacy' on the Ballot for Kentucky Senate Race
2025-05-10,unknown,Zelenskyy agrees to meet with Putin on Thursday
2025-05-10,the-irish-times,The Irish Times view on qualified majority voteing: a concern for Ireland
2025-05-10,usa-today,Zelenskyy agrees to meet Putin after Trump post; unclear if Russian president will join
2025-05-10,unknown,Trump urges Ukraine to accept peace talks with Putin ‘immediately’ — without cease-fire
2025-05-10,unknown,Trump’s Latest Conflict of Interest? Accepting a Plane From Qatari Royals
2025-05-10,breitbart-news,Poland Accuses Russia of Arson Attack on Warsaw Shopping Complex
2025-05-10,unknown,Here's What Happened Today: Sunday
2025-05-10,unknown,Revolution from the Soil: Anti-Imperialism and Food Sovereignty in Burkina Faso
2025-05-10,unknown,How biblical justice finally caught up to a leftist judge
2025-05-10,unknown,"How Ukrainians Are Fighting Back Against Russia, Through Ballet"
2025-05-10,unknown,"Russia Was Behind Vast 2024 Fire, Poland Says"
2025-05-10,unknown,‘Never again war’: Pope Leo calls for peace in Ukraine in first Sunday address - The Guardian
2025-05-10,the-times-of-india,US inflation starting to stir as Trump tariff threat looms
2025-05-10,breitbart-news,"Zelensky Willing to 'Personally' Meet With Putin in Istanbul, But Demands Ceasefire Before Talks"
2025-05-10,the-irish-times,Scenes in Clones and Croke Park show provincial titles are still worth their weight in gold
2025-05-10,unknown,'It never gets easier': Woman who lost father and son in Bradford City fire speaks 40 years on
2025-05-10,rt,French party leader praises Moscow’s peace talks proposal
2025-05-10,unknown,AI endorses and affirms your delusions
2025-05-10,abc-news-au,Zelenskyy agrees to meet Putin face-to-face for Ukraine war talks
2025-05-10,unknown,Trump ‘starting to doubt Ukraine will make a deal with Putin’
2025-05-10,unknown,‘Thunderbolts*’ Nears $300M Global As Does ‘Sinners’; ‘Minecraft’s Whole Lotta Lava Tops $900M WW & $500M Overseas – International Box Office
2025-05-10,unknown,Pope Leo appeals for no more war in first Sunday address
2025-05-10,rt,Venezuela welcomes Putin’s Ukraine peace talks proposal
2025-05-10,unknown,"Peak Oil In America: “Drill, Baby, Drill” May Be Hitting A Wall"
2025-05-10,unknown,Zelensky offers to meet Putin after Trump demands Ukraine hold direct talks with Russia - BBC
2025-05-10,unknown,"Frustrated Trump slams Putin, Ukraine as peace talk hopes falter - politico.eu"
2025-05-10,unknown,Dancing with wolves: Europe’s ceasefire ultimatum to Vladimir Putin falters at first test
2025-05-10,unknown,Zelenskyy says he is ready to meet with Putin
2025-05-10,unknown,SECURITY AFFAIRS MALWARE NEWSLETTER ROUND 45
2025-05-10,unknown,Zelensky to travel to Turkey for potential talks with Putin
2025-05-10,unknown,Pope Leo Calls For Peace and Aid in Gaza As Trump Sets Off To the Middle East
2025-05-10,the-jerusalem-post,University of Toronto Faculty Association votes to divest from Israel
2025-05-11,unknown,"London crippled by massive power outage, subway system grinds to a halt"
2025-05-11,unknown,Phuket unfazed by weak Chinese market
2025-05-11,the-times-of-india,We won't tolerate nuclear blackmail: PM Modi warns Pakistan
2025-05-11,nbc-news,Ms. Rachel doubles down support for children in Gaza
2025-05-11,abc-news-au,"Russia responsible for downing flight MH17, UN aviation agency says"
2025-05-11,unknown,"‘Adapt, but don’t divert’, cohesion policy critics fear defence stealth funding [Advocacy Lab Content]"
2025-05-11,unknown,Episcopal church ends partnership with feds to resettle refugees because now some are white
2025-05-11,unknown,"For the First Time, the World Favors China Over the U.S."
2025-05-11,unknown,Poland says Russia recruited arsonists for Warsaw fire on social media
2025-05-11,unknown,The French GP with Boris
2025-05-11,unknown,Ukraine relies on secret weapon in its drone attacks on Russia
2025-05-11,unknown,Star-shaped small-molecule hole-transport materials for dopant-free perovskite solar cells
2025-05-11,unknown,Anwar heads to Russia for Putin talks and KazanForum
2025-05-11,unknown,Video does not show Macron hiding bag of cocaine from photographers
2025-05-11,unknown,"HighPeak Energy, Inc. Announces First Quarter 2025 Financial and Operating Results - AMENDED"
2025-05-11,unknown,Trump starts his foreign trip with a crush of problems — and outsized certainty he has the answers
2025-05-11,unknown,New pope breaks with Francis to support Kyiv and ceasefire push (Financial Times)
2025-05-11,unknown,Last living American hostage released by Hamas as Netanyahu plans for Gaza’s reoccupation
2025-05-11,unknown,Books on how to converse with Trumpers?
2025-05-11,unknown,"Catheter Precision, Inc. Announces $1.5 Million Private Placement Equity Financing and Potential Strategic Alliance"
2025-05-11,unknown,BREAKING: The first set of White South Africans fleeing Genocide have arrived in the United States
2025-05-11,unknown,Zelensky says he’s ready to meet Putin; Europe prepares sanctions - The Washington Post
2025-05-11,unknown,"Inside Putin’s New Kill Squad: Russian Dictator Launches 'KGB 2.0' — a Shadowy New Spy Unit Tasked With Sabotage, Cyber Attacks and Assassinations"
2025-05-11,unknown,"Trump Tells Russia, Ukraine to 'Finish This Stupid War'"
2025-05-11,unknown,Meet the hot and sexy queer men of 'Elska Chisinau'
2025-05-11,unknown,Trump offers to join potential Russia-Ukraine talks in Turkey
2025-05-11,unknown,Galaxy Buds Core's Battery Will Put Buds 3 Pro to Shame
2025-05-11,unknown,"Hollywood Stars Condemn Gaza ""Genocide"" On Eve Of Cannes Festival"
2025-05-11,unknown,Nations Meet At UN For 'Killer Robot' Talks
2025-05-11,unknown,Statement by the High Representative on behalf of the EU on the alignment of certain countries concerning restrictive measures directed against certain persons and entities in view of the situation in Iran
2025-05-11,unknown,The High Representative issued a statement on behalf of the EU on the alignment of certain countries concerning restrictive measures directed against certain persons and entities in view of the situation in Iran
2025-05-11,abc-news-au,DJ dreamed of becoming a concert pianist until he had a stroke. This music inspired him to play again
2025-05-11,unknown,SOF Week 25 – Defendtex Optical Fiber Drone Guidance
2025-05-11,unknown,‘Not That Liberal’: Brother Assures Piers Morgan Pope Leo XIV Will Not ‘Pull The Church Hard-Left’
2025-05-11,unknown,Poland says Russia recruited arsonists online for Warsaw fire
2025-05-11,unknown,Alex Jones Shares Fake Photo of Pro-Ukraine Leaders With ‘Cocaine’ on Train
2025-05-11,unknown,Jude Law and Andrew Garfield Cast as Siegfried & Roy in Apple TV+ Series ‘Wild Things’
2025-05-11,newsweek,UFC Has a Major Islam Makhachev and Ilia Topuria Problem
2025-05-11,nbc-news,Honeytraps and high tech: Russian spy ring members jailed in the U.K.
2025-05-11,unknown,Nations meet at U.N. for 'killer robot' talks as regulation lags
2025-05-11,unknown,"Texas bans foreign land ownership from China, Russia, Iran, North Korea"
2025-05-11,unknown,6 Bulgarians convicted in UK of spying for Russia get prison terms up to nearly 11 years
2025-05-11,unknown,Trump offers to join Russia-Ukraine talks in Turkey
2025-05-11,unknown,Europe Waits for Turkey Summit to Ask Trump for Russia Sanctions
2025-05-11,unknown,Trump To Turkey? President Floats Joining Russia-Ukraine Peace Talks
2025-05-11,unknown,Hollywood Stars Condemn Gaza 'Genocide' On Eve Of Cannes Festival
2025-05-11,rt,Moldovan leader promises to join EU by 2028
2025-05-11,unknown,What’s next with Trump’s trade war truce with China
2025-05-11,unknown,Trading Day: Tariff truce a market 'game changer'
2025-05-11,unknown,"PKK to Disband, End Insurgency in Turkey"
2025-05-11,unknown,TRAGEDY: MH17 downed by Russia rules ICAO
2025-05-11,abc-news-au,Pope Francis was close to other religious leaders. Will Pope Leo follow suit?
2025-05-11,unknown,Microvast Reports First Quarter 2025 Financial Results
2025-05-11,unknown,Hegel 2.0: The imaginary history of ternary computing (2018)
2025-05-11,unknown,Texas push to ban non-citizens from buying land prompts racism worries
2025-05-11,unknown,Top 50 Most Viewed YouTube Channels Worldwide • Week Of 05/11/2025
2025-05-11,unknown,How Trump Can Reset His Failed Ukraine Policy
2025-05-11,unknown,Daily Press Briefing by the Office of the Spokesperson for the Secretary-General
2025-05-11,newsweek,'Throat Slitting' Sign to Hamas Attack Survivor Raises Eurovision Concerns
2025-05-11,unknown,Supreme Court justice’s agenda to ‘fight’ Trump reveals evidence of ‘judicial overreach’
2025-05-11,unknown,"Poland to close Russian consulate in Krakow, citing arson attack"
2025-05-11,abc-news,WATCH: Edan Alexander reunites with family after being freed from Hamas captivity
2025-05-11,unknown,"Long Read: Booing, Supporter Identity, and Hypocrisy in Football Fandom"
2025-05-11,breitbart-news,Pope Leo XIV Addresses Journalists: Help Protect 'Precious Gift of Free Speech'
2025-05-11,unknown,Satellogic Secures Multi-Million Dollar Agreement with Asia Pacific Customer
2025-05-11,unknown,Vital Energy Reports First-Quarter 2025 Financial and Operating Results
2025-05-11,unknown,Carbon Revolution Sets Date for Fiscal 2024 Earnings Release and Conference Call
2025-05-11,rt,Trump mulls participation in Russia-Ukraine talks
2025-05-11,unknown,"Trump mulls joining Ukraine talks in Türkiye, Kremlin silent on Putin"
2025-05-11,unknown,Trump offers to join potential Russia-Ukraine talks in Türkiye
2025-05-11,unknown,Ukraine’s Latest Drone-Killer Is A Truck Firing Surplus Air-to-Air Missiles
2025-05-11,unknown,Matthews International Announces Acquisition of the Dodge Company
2025-05-11,unknown,Trump could join Russia-Ukraine peace talks in Turkey - Financial Times
2025-05-11,unknown,U.S. CISA adds TeleMessage TM SGNL to its Known Exploited Vulnerabilities catalog
2025-05-11,unknown,Maravai Lifesciences Reports First Quarter 2025 Financial Results
2025-05-11,unknown,Special Price on ‘James Krenov: Leave Fingerprints’
2025-05-11,unknown,Carbon Revolution Secures Further Release of $5m Million from OIC and further $0.4 Million Reserve Release from Existing Lenders
