created_at,account,id,text
2025-05-26 00:46:06.770000+00:00,realDonaldTrump,114571369956761390,"I’ve always had a very good relationship with Vladimir Putin of Russia, but something has happened to him. He has gone absolutely CRAZY! He is needlessly killing a lot of people, and I’m not just talking about soldiers. Missiles and drones are being shot into Cities in Ukraine, for no reason whatsoever. I’ve always said that he wants ALL of Ukraine, not just a piece of it, and maybe that’s proving to be right, but if he does, it will lead to the downfall of Russia! Likewise, President Zelenskyy is doing his Country no favors by talking the way he does. Everything out of his mouth causes problems, I don’t like it, and it better stop. This is a War that would never have started if I were President. This is Zelenskyy’s, Putin’s, and Biden’s War, not “Trump’s,” I am only helping to put out the big and ugly fires, that have been started through Gross Incompetence and Hatred."
2025-05-23 09:43:05.024000+00:00,realDonaldTrump,114556494480941887,A major prisoners swap was just completed between Russia and Ukraine. It will go into effect shortly. Congratulations to both sides on this negotiation. This could lead to something big???
2025-05-19 17:33:06.392000+00:00,realDonaldTrump,114535693441367601,"Just completed my two hour call with President Vladimir Putin of Russia. I believe it went very well. Russia and Ukraine will immediately start negotiations toward a Ceasefire and, more importantly, an END to the War. The conditions for that will be negotiated between the two parties, as it can only be, because they know details of a negotiation that nobody else would be aware of. The tone and spirit of the conversation were excellent. If it wasn’t, I would say so now, rather than later. Russia wants to do largescale TRADE with the United States when this catastrophic “bloodbath” is over, and I agree. There is a tremendous opportunity for Russia to create massive amounts of jobs and wealth. Its potential is UNLIMITED. Likewise, Ukraine can be a great beneficiary on Trade, in the process of rebuilding its Country. Negotiations between Russia and Ukraine will begin immediately. I have so informed President Volodymyr Zelenskyy, of Ukraine, Ursula von der Leyen, President of the European Commission, President Emmanuel Macron, of France, Prime Minister Giorgia Meloni, of Italy, Chancellor Friedrich Merz, of Germany, and President Alexander Stubb, of Finland, during a call with me, immediately after the call with President Putin. The Vatican, as represented by the Pope, has stated that it would be very interested in hosting the negotiations. Let the process begin!"
2025-05-17 14:58:48.603000+00:00,realDonaldTrump,114523762104941397,"I WILL BE SPEAKING, BY TELEPHONE, TO PRESIDENT VLADIMIR PUTIN OF RUSSIA ON MONDAY, AT 10:00 A.M. THE SUBJECTS OF THE CALL WILL BE, STOPPING THE “BLOODBATH” THAT IS KILLING, ON AVERAGE, MORE THAN 5000 RUSSIAN AND UKRAINIAN SOLDIERS A WEEK, AND TRADE. I WILL THEN BE SPEAKING TO PRESIDENT ZELENSKYY OF UKRAINE AND THEN, WITH PRESIDENT ZELENSKYY, VARIOUS MEMBERS OF NATO. HOPEFULLY IT WILL BE A PRODUCTIVE DAY, A CEASEFIRE WILL TAKE PLACE, AND THIS VERY VIOLENT WAR, A WAR THAT SHOULD HAVE NEVER HAPPENED, WILL END. GOD BLESS US ALL!!!"
2025-05-11 22:38:16.931000+00:00,realDonaldTrump,114491594957458207,"I am happy to announce that Edan Alexander, an American citizen who has been held hostage since October 2023, is coming home to his family. I am grateful to all those involved in making this monumental news happen. This was a step taken in good faith towards the United States and the efforts of the mediators — Qatar and Egypt — to put an end to this very brutal war and return ALL living hostages and remains to their loved ones. Hopefully this is the first of those final steps necessary to end this brutal conflict. I look very much forward to that day of celebration!"
2025-05-11 16:16:21.630000+00:00,realDonaldTrump,114490093180275292,"President Putin of Russia doesn’t want to have a Cease Fire Agreement with Ukraine, but rather wants to meet on Thursday, in Turkey, to negotiate a possible end to the BLOODBATH. Ukraine should agree to this, IMMEDIATELY. At least they will be able to determine whether or not a deal is possible, and if it is not, European leaders, and the U.S., will know where everything stands, and can proceed accordingly! I’m starting to doubt that Ukraine will make a deal with Putin, who’s too busy celebrating the Victory of World War ll, which could not have been won (not even close!) without the United States of America. HAVE THE MEETING, NOW!!!"
2025-05-11 04:03:12.428000+00:00,realDonaldTrump,114487210304050642,"A potentially great day for Russia and Ukraine! Think of the hundreds of thousands of lives that will be saved as this never ending “bloodbath” hopefully comes to an end. It will be a whole new, and much better, WORLD. I will continue to work with both sides to make sure that it happens. The USA wants to focus, instead, on Rebuilding and Trade. A BIG week upcoming!"
2025-05-08 20:38:26.460000+00:00,realDonaldTrump,114474136794655068,"Talks with Russia/Ukraine continue. The U.S. calls for, ideally, a 30-day unconditional ceasefire. Hopefully, an acceptable ceasefire will be observed, and both Countries will be held accountable for respecting the sanctity of these direct negotiations. If the ceasefire is not respected, the U.S. and its partners will impose further sanctions. Thousands of young soldiers are dying on a weekly basis, and everybody should want it to STOP. I do, and the United States of America does, also. As President, I will stay committed to securing Peace between Russia and Ukraine, together with the Europeans, and a Lasting Peace it will be! This ceasefire must ultimately build toward a Peace Agreement. It can all be done very quickly, and I will be available on a moment’s notice if my services are needed. Thank you for your attention to this matter!"
2025-05-05 15:10:29.056000+00:00,realDonaldTrump,114455860282159313,"I just had a very good and productive telephone conversation with the President of Turkey, Recep Erdoğan, concerning many subjects, including the War with Russia/Ukraine, all things Syria, Gaza, and more. The President invited me to go to Turkey at a future date and, likewise, he will be coming to Washington, D.C. During my four years as President, my relationship with President Erdoğan was excellent. We worked together closely on numerous things, including the fact that he helped return Pastor Andrew Brunson, who was imprisoned, back to the United States — Immediately upon my request. In any event, I look forward to working with President Erdoğan on getting the ridiculous, but deadly, War between Russia and Ukraine ended — NOW!"
2025-04-26 13:35:04.678000+00:00,realDonaldTrump,114404524335638236,"No matter what deal I make with respect to Russia/Ukraine, no matter how good it is, even if it’s the greatest deal ever made, The Failing New York Times will speak BADLY of it. Liddle’ Peter Baker, the very biased and untalented writer for The Times, followed his Editor’s demands and wrote that Ukraine should get back territory, including, I suppose, Crimea, and other ridiculous requests, in order to stop the killing that is worse than anything since World War II. Why doesn’t this lightweight reporter say that it was Obama who made it possible for Russia to steal Crimea from Ukraine without even a shot being fired. It was also Liddle’ Peter who wrote an absolutely fawning, yet terribly  written Biography, on Obama. It was a JOKE! Did Baker ever criticize the Obama Crimea Giveaway? NO, not once, only TRUMP, and I’ve had nothing to do with this stupid war, other than early on, when I gave Ukraine Javelins, and Obama gave them sheets. This is Sleepy Joe Biden’s War, not mine. It was a loser from day one, and should have never happened, and wouldn’t have happened if I were President at the time. I’m just trying to clean up the mess that was left to me by Obama and Biden, and what a mess it is. With all of that being said, there was no reason for Putin to be shooting missiles into civilian areas, cities and towns, over the last few days. It makes me think that maybe he doesn’t want to stop the war, he’s just tapping me along, and has to be dealt with differently, through “Banking” or “Secondary Sanctions?” Too many people are dying!!!"
2025-04-25 21:49:22.849000+00:00,realDonaldTrump,114400805703099287,"Just landed in Rome. A good day in talks and meetings with Russia and Ukraine. They are very close to a deal, and the two sides should now meet, at very high levels, to “finish it off.” Most of the major points are agreed to. Stop the bloodshed, NOW. We will be wherever is necessary to help facilitate the END to this cruel and senseless war!"
2025-04-24 12:24:45.921000+00:00,realDonaldTrump,114392923237368367,"I am not happy with the Russian strikes on KYIV. Not necessary, and very bad timing. Vladimir, STOP! 5000 soldiers a week are dying. Lets get the Peace Deal DONE!"
2025-04-20 20:15:51.314000+00:00,realDonaldTrump,114372126396548824,"HOPEFULLY RUSSIA AMD UKRAINE WILL MAKE A DEAL THIS WEEK. BOTH WILL THEN START TO DO BIG BUSINESS WITH THE UNITED STATES OF AMERICA, WHICH IS THRIVING, AND MAKE A FORTUNE!"
2025-04-14 14:12:30.017000+00:00,realDonaldTrump,114336723764365914,"The War between Russia and Ukraine is Biden’s war, not mine. I just got here, and for four years during my term, had no problem in preventing it from happening. President Putin, and everyone else, respected your President! I HAD NOTHING TO DO WITH THIS WAR, BUT AM WORKING DILIGENTLY TO GET THE DEATH AND DESTRUCTION TO STOP. If the 2020 Presidential Election was not RIGGED, and it was, in so many ways, that horrible War would never have happened. President Zelenskyy and Crooked Joe Biden did an absolutely horrible job in allowing this travesty to begin. There were so many ways of preventing it from ever starting. But that is the past. Now we have to get it to STOP, AND FAST. SO SAD!"
2025-04-11 13:35:50.763000+00:00,realDonaldTrump,114319592702753512,"Russia has to get moving. Too many people ere DYING, thousands a week, in a terrible and senseless war - A war that should have never happened, and wouldn’t have happened, if I were President!!!"
2025-04-01 00:02:10.066000+00:00,realDonaldTrump,114259770085623128,https://www.newsmax.com/newsmax-tv/donald-trump-russia-tommy-tuberville/2025/03/13/id/1202682/
2025-03-31 23:05:13.804000+00:00,realDonaldTrump,114259546197388041,“Europe Should Make a $200 Billion Deal With Trump” https://foreignpolicy.com/2025/03/05/trump-zelensky-ukraine-russia-arms-weapons-eu-europe-war/
2025-03-19 20:26:27.987000+00:00,realDonaldTrump,114190974188613740,"General Keith Kellogg: “President Trump is absolutely right, this war wouldn’t have started if he were President…”"
2025-03-19 20:08:30.442000+00:00,realDonaldTrump,114190903570658626,"YOU HAVE A SITUATION (RUSSIA-UKRAINE) WHERE YOU HAVE A LOT OF GUNS POINTING AT EACH OTHER, FOOLISHLY—BECAUSE IT WOULD HAVE NEVER HAPPENED IF I WAS PRESIDENT…"
2025-03-19 15:38:22.279000+00:00,realDonaldTrump,114189841352600682,"Just completed a very good telephone call with President Zelenskyy of Ukraine. It lasted approximately one hour. Much of the discussion was based on the call made yesterday with President Putin in order to align both Russia and Ukraine in terms of their requests and needs. We are very much on track, and I will ask Secretary of State Marco Rubio, and National Security Advisor Michael Waltz, to give an accurate description of the points discussed. That Statement will be put out shortly."
2025-03-18 18:49:43.170000+00:00,realDonaldTrump,114184931453780675,"My phone conversation today with President Putin of Russia was a very good and productive one. We agreed to an immediate Ceasefire on all Energy and Infrastructure, with an understanding that we will be working quickly to have a Complete Ceasefire and, ultimately, an END to this very horrible War between Russia and Ukraine. This War would have never started if I were President! Many elements of a Contract for Peace were discussed, including the fact that thousands of soldiers are being killed, and both President Putin and President Zelenskyy would like to see it end. That process is now in full force and effect, and we will, hopefully, for the sake of Humanity, get the job done!"
2025-03-17 22:28:28.890000+00:00,realDonaldTrump,114180129350673750,"Tomorrow morning I will be speaking to President Putin concerning the War in Ukraine. Many elements of a Final Agreement have been agreed to, but much remains. Thousands of young soldiers, and others, are being killed. Each week brings 2,500 soldier deaths, from both sides, and it must end NOW. I look very much forward to the call with President Putin."
2025-03-15 18:34:55.424000+00:00,realDonaldTrump,114167886343462616,"I am pleased to inform you that General Keith Kellogg has been appointed Special Envoy to Ukraine. General Kellogg, a Highly Respected Military Expert, will deal directly with President Zelenskyy, and Ukrainian leadership. He knows them well, and they have a very good working relationship together. Congratulations to General Kellogg!"
2025-03-15 17:02:50.239000+00:00,realDonaldTrump,114167524244753377,"The Fake News, as usual, is at it again! Why can’t they be honest, just for once? Last night I read that President Vladimir Putin of Russia kept my Highly Respected Ambassador and Special Envoy, Steve Witkoff, waiting for over nine hours when, in fact, there was no wait whatsoever. Other meetings with other Representatives of Russia did take place and, obviously, they took some time, but they were very productive. From there, things went quickly and efficiently, and all signs seem to be, hopefully, very good! In conclusion, there was no nine hour wait, or any wait at all! The only reason they made up that story is to try and DEMEAN, because they are sick degenerates, that have to start reporting the News correctly. This is why they have lost their ratings, their audience, and respect. Thank you for your attention to this matter and, GOD BLESS AMERICA!DONALD J. TRUMP, PRESIDENT OF THE UNITED STATES OF AMERICA"
2025-03-14 13:33:39.916000+00:00,realDonaldTrump,114161039436456514,"We had very good and productive discussions with President Vladimir Putin of Russia yesterday, and there is a very good chance that this horrible, bloody war can finally come to an end — BUT, AT THIS VERY MOMENT, THOUSANDS OF UKRAINIAN TROOPS ARE COMPLETELY SURROUNDED BY THE RUSSIAN MILITARY, AND IN A VERY BAD AND VULNERABLE POSITION. I have strongly requested to President Putin that their lives be spared. This would be a horrible massacre, one not seen since World War II. God bless them all!!!"
2025-03-14 11:29:15.354000+00:00,realDonaldTrump,114160550238908846,"Crooked Joe Biden got us into a real “mess” with Russia (and EVERYTHING ELSE!), but I’m going to get us out. Millions of people are needlessly dead, never to be seen again…and there will be many more to follow if we don’t get the Cease Fire and Final Agreement with Russia completed and signed. There would have been NO WAR if I were President. It just, 100%, would not have happened. Likewise, there would have been no October 7th with Israel, the pullout from Afghanistan would have been done with strength and pride, and would not have been the most embarrassing day in the history of our Country, it could have been a moment of glory. Also, there would not have been any perceptible inflation - Instead we had Record Setting, Country Destroying Inflation, like we have never seen before. Also, we would have had an impenetrable Border, with very few illegals getting in. Oh, what a difference A RIGGED &amp; CROOKED ELECTION HAD ON OUR COUNTRY, AND THE PEOPLE WHO DID THIS TO US SHOULD GO TO JAIL! GOD BLESS AMERICA AND, MAKE AMERICA GREAT AGAIN!"
2025-03-10 15:49:29.105000+00:00,realDonaldTrump,114138924260124808,https://www.theguardian.com/world/2025/feb/24/eu-spends-more-russian-oil-gas-than-financial-aid-ukraine-report
2025-03-08 02:44:40.370000+00:00,realDonaldTrump,114124513631913892,Senator Eric Schmitt: “The shift that you're seeing in the foreign policy of the United States is a shift to REALISM — the American taxpayers are tapped out of this war in Ukraine. President Trump is trying to bring PEACE!”
2025-03-07 14:17:41.314000+00:00,realDonaldTrump,114121576367163341,"Based on the fact that Russia is absolutely “pounding” Ukraine on the battlefield right now, I am strongly considering large scale Banking Sanctions, Sanctions, and Tariffs on Russia until a Cease Fire and FINAL SETTLEMENT AGREEMENT ON PEACE IS REACHED. To Russia and Ukraine, get to the table right now, before it is too late. Thank you!!!"
2025-03-03 18:31:25.202000+00:00,realDonaldTrump,114099924838350231,Europe has spent more money buying Russian Oil and Gas than they have spent on defending Ukraine —BY FAR!
2025-03-03 16:38:26.224000+00:00,realDonaldTrump,114099480566604857,"This is the worst statement that could have been made by Zelenskyy, and America will not put up with it for much longer! It is what I was saying, this guy doesn’t want there to be Peace as long as he has America’s backing and, Europe, in the meeting they had with Zelenskyy, stated flatly that they cannot do the job without the U.S. – Probably not a great statement to have been made in terms of a show of strength against Russia. What are they thinking? https://apnews.com/article/russia-ukraine-war-zelenskyy-starmer-trump-b025877c40ffe0ddf2a92adad1715231"
2025-02-28 18:16:10.692000+00:00,realDonaldTrump,114082877976878390,"A Statement from President Donald J. Trump“We had a very meaningful meeting in the White House today. Much was learned that could never be understood without conversation under such fire and pressure. It’s amazing what comes out through emotion, and I have determined that President Zelenskyy is not ready for Peace if America is involved, because he feels our involvement gives him a big advantage in negotiations. I don’t want advantage, I want PEACE. He disrespected the United States of America in its cherished Oval Office. He can come back when he is ready for Peace.”"
2025-02-24 19:51:33.236000+00:00,realDonaldTrump,114060603767862225,We're helping Ukraine like nobody has ever helped Ukraine before…
2025-02-24 17:00:18.864000+00:00,realDonaldTrump,114059930426328863,"Today, President Emmanuel Macron of France joined me in the Oval Office to speak to the G7 Summit. The meeting was convened by Governor Justin Trudeau of Canada, the current chair of G7, to acknowledge the Third Anniversary of the Russia-Ukraine War – Which would have never started if I was President. Everyone expressed their goal of seeing the War end, and I emphasized the importance of the vital “Critical Minerals and Rare-Earths Deal” between the United States and Ukraine, which we hope will be signed very soon! This deal, which is an “Economic Partnership,” will ensure the American people recoup the Tens of Billions of Dollars and Military Equipment sent to Ukraine, while also helping Ukraine’s economy grow as this Brutal and Savage War comes to an end. At the same time, I am in serious discussions with President Vladimir Putin of Russia concerning the ending of the War, and also major Economic Development transactions which will take place between the United States and Russia. Talks are proceeding very well!"
2025-02-20 00:40:10.029000+00:00,realDonaldTrump,114033427089061668,"Elon Musk: “The President’s instincts on Ukraine are absolutely right. It is really sad that so many parents have lost their sons, and so many sons their fathers in this pointless war.”"
2025-02-19 15:47:35.612000+00:00,realDonaldTrump,114031332924234939,"Think of it, a modestly successful comedian, Volodymyr Zelenskyy, talked the United States of America into spending $350 Billion Dollars, to go into a War that couldn’t be won, that never had to start, but a War that he, without the U.S. and “TRUMP,” will never be able to settle. The United States has spent $200 Billion Dollars more than Europe, and Europe’s money is guaranteed, while the United States will get nothing back. Why didn’t Sleepy Joe Biden demand Equalization, in that this War is far more important to Europe than it is to us — We have a big, beautiful Ocean as separation. On top of this, Zelenskyy admits that half of the money we sent him is “MISSING.” He refuses to have Elections, is very low in Ukrainian Polls, and the only thing he was good at was playing Biden “like a fiddle.” A Dictator without Elections, Zelenskyy better move fast or he is not going to have a Country left. In the meantime, we are successfully negotiating an end to the War with Russia, something all admit only “TRUMP,” and the Trump Administration, can do. Biden never tried, Europe has failed to bring Peace, and Zelenskyy probably wants to keep the “gravy train” going. I love Ukraine, but Zelenskyy has done a terrible job, his Country is shattered, and MILLIONS have unnecessarily died – And so it continues….."
2025-02-17 16:11:44.838000+00:00,realDonaldTrump,114020103280221743,https://www.foxnews.com/world/trump-no-one-else-can-end-ukraine-russia-war-us-ally-says
2025-02-13 11:52:17.978000+00:00,realDonaldTrump,113996433848678436,"GREAT TALKS WITH RUSSIA AND UKRAINE YESTERDAY. GOOD POSSIBILITY OF ENDING THAT HORRIBLE, VERY BLOODY WAR!!!"
2025-02-12 18:11:59.063000+00:00,realDonaldTrump,113992264519415084,"I just spoke to President Volodymyr Zelenskyy of Ukraine. The conversation went very well. He, like President Putin, wants to make PEACE. We discussed a variety of topics having to do with the War, but mostly, the meeting that is being set up on Friday in Munich, where Vice President JD Vance and Secretary of State Marco Rubio will lead the Delegation. I am hopeful that the results of that meeting will be positive. It is time to stop this ridiculous War, where there has been massive, and totally unnecessary, DEATH and DESTRUCTION. God bless the people of Russia and Ukraine!"
2025-02-12 16:53:38.679000+00:00,realDonaldTrump,113991956474899296,"I just had a lengthy and highly productive phone call with President Vladimir Putin of Russia. We discussed Ukraine, the Middle East, Energy, Artificial Intelligence, the power of the Dollar, and various other subjects. We both reflected on the Great History of our Nations, and the fact that we fought so successfully together in World War II, remembering, that Russia lost tens of millions of people, and we, likewise, lost so many! We each talked about the strengths of our respective Nations, and the great benefit that we will someday have in working together. But first, as we both agreed, we want to stop the millions of deaths taking place in the War with Russia/Ukraine. President Putin even used my very strong Campaign motto of, “COMMON SENSE.” We both believe very strongly in it. We agreed to work together, very closely, including visiting each other’s Nations. We have also agreed to have our respective teams start negotiations immediately, and we will begin by calling President Zelenskyy, of Ukraine, to inform him of the conversation, something which I will be doing right now. I have asked Secretary of State Marco Rubio, Director of the CIA John Ratcliffe, National Security Advisor Michael Waltz, and Ambassador and Special Envoy Steve Witkoff, to lead the negotiations which, I feel strongly, will be successful. Millions of people have died in a War that would not have happened if I were President, but it did happen, so it must end. No more lives should be lost! I want to thank President Putin for his time and effort with respect to this call, and for the release, yesterday, of Marc Fogel, a wonderful man that I personally greeted last night at the White House. I believe this effort will lead to a successful conclusion, hopefully soon!"
2025-02-11 16:49:59.888000+00:00,realDonaldTrump,113986279826269375,"I am sending Secretary of the Treasury Scott Bessent to Ukraine to meet President Zelensky. This War MUST and WILL END SOON — Too much Death and Destruction. The U.S. has spent BILLIONS of Dollars Globally, with little to show. WHEN AMERICA IS STRONG, THE WORLD IS AT PEACE."
2025-01-22 15:46:08.868000+00:00,realDonaldTrump,113872782548137314,"I’m not looking to hurt Russia. I love the Russian people, and always had a very good relationship with President Putin - and this despite the Radical Left’s Russia, Russia, Russia HOAX. We must never forget that Russia helped us win the Second World War, losing almost 60,000,000 lives in the process. All of that being said, I’m going to do Russia, whose Economy is failing, and President Putin, a very big FAVOR. Settle now, and STOP this ridiculous War! IT’S ONLY GOING TO GET WORSE. If we don’t make a “deal,” and soon, I have no other choice but to put high levels of Taxes, Tariffs, and Sanctions on anything being sold by Russia to the United States, and various other participating countries. Let’s get this war, which never would have started if I were President, over with! We can do it the easy way, or the hard way - and the easy way is always better. It’s time to “MAKE A DEAL.” NO MORE LIVES SHOULD BE LOST!!!"
2025-01-08 23:08:58.401000+00:00,realDonaldTrump,113795251463856098,https://thehill.com/opinion/5039301-trump-ceasefire-ukraine-war/
2024-12-26 18:43:20.524000+00:00,realDonaldTrump,113720596923948103,“Putin says he’s ‘ready’ for potential talks with Trump during year-end news conference” https://www.cnn.com/2024/12/19/europe/putin-russia-ukraine-news-conference-intl/index.html
